Công Ty TNHH Dũng Thành Phát	Lạng Sơn	Số 29A ngõ 8 đường Bắc Sơn - Phường Hoàng Văn Thụ - Thành phố Lạng Sơn - Lạng Sơn	In ấn	4900653520	06-05-2011
Công Ty Cổ Phần Cuộc Sống Và Những Người Bạn	Lạng Sơn	Số 8/2, đường Bắc Sơn - Phường Vĩnh Trại - Thành phố Lạng Sơn - Lạng Sơn	Lắp đặt hệ thống điện	4900653104	05-05-2011
Công Ty Cổ Phần Rượu Bia Thành Lợi	Lạng Sơn	Số 441, đường Bà Triệu, phường Đông Kinh - Thành phố Lạng Sơn - Lạng Sơn	Chưng, tinh cất và pha chế các loại rượu mạnh	4900653136	05-05-2011
Công Ty TNHH Mtv Mỹ Hưng Ls	Lạng Sơn	Số 214, đường Ngô Quyền - Phường Đông Kinh - Thành phố Lạng Sơn - Lạng Sơn	Dịch vụ lưu trú ngắn ngày	4900652245	04-05-2011
Công Ty Trách Nhiệm Hữu Hạn E-She Việt Nam	Lạng Sơn	Số 703 đường Trần Đăng Ninh - Xã Hoàng Đồng - Thành phố Lạng Sơn - Lạng Sơn	Bán buôn chuyên doanh khác chưa được phân vào đâu	4900651749	26-04-2011
Chi Nhánh Công Ty TNHH Phú Sơn Hà Tại Lạng Sơn	Lạng Sơn	Số nhà 18C đường Lê Đại Hành - Phường Vĩnh Trại - Thành phố Lạng Sơn - Lạng Sơn	Khai thác quặng sắt	0101355337-004	25-04-2011
Công Ty TNHH Mtv Đại Phúc Ls	Lạng Sơn	Số 315A, đường Nhị Thanh - Phường Tam Thanh - Thành phố Lạng Sơn - Lạng Sơn	Vệ sinh nhà cửa và các công trình khác	4900651523	25-04-2011
Công Ty TNHH Mtv Sản Xuất Và Thương Mại Nghĩa Thịnh	Lạng Sơn	Số 28, đường Lý Thái Tổ - Phường Đông Kinh - Thành phố Lạng Sơn - Lạng Sơn	Bán lẻ đồ điện gia dụng, giường, tủ, bàn, ghế và đồ nội thất tương tự, đèn và bộ đèn điện, đồ dùng gia đình khác chưa được phân vào đâu trong các cửa hàng chuyên doanh	4900650978	22-04-2011
Công Ty TNHH Mtv Khánh Cường LS	Lạng Sơn	Ngõ 02 Đ. Nguyễn Đình Chiểu, tổ 05, khối 09 - Phường Đông Kinh - Thành phố Lạng Sơn - Lạng Sơn	Khai thác đá, cát, sỏi, đất sét	4900650865	20-04-2011
Công Ty TNHH Mtv Thương Mại Quang Minh Lạng Sơn	Lạng Sơn	Số 36, đường Nhị Thanh - Phường Tam Thanh - Thành phố Lạng Sơn - Lạng Sơn	Bán lẻ đồ ngũ kim, sơn, kính và thiết bị lắp đặt khác trong xây dựng trong các cửa hàng chuyên doanh	4900650872	20-04-2011
Công Ty TNHH Hoàng Lộc Lạng Sơn	Lạng Sơn	Số 35 tổ 5 khối 8 ngõ 1 đường Ngô Quyền - Phường Vĩnh Trại - Thành phố Lạng Sơn - Lạng Sơn	Xây dựng nhà các loại	4900647911	07-04-2011
Công Ty Cổ Phần Thương Mại Hoàng Nguyên Lạng Sơn	Lạng Sơn	Số 54, đường Bắc Sơn - Phường Hoàng Văn Thụ - Thành phố Lạng Sơn - Lạng Sơn	Bán buôn tổng hợp	4900647809	07-04-2011
Công Ty TNHH Hoàng Đại Nghĩa	Lạng Sơn	Số 03 đường Văn Miếu - Thành phố Lạng Sơn - Lạng Sơn	Vận tải hàng hóa bằng đường bộ	4900647904	07-04-2011
Công Ty Cổ Phần Vận Tải Vạn An	Lạng Sơn	Số 387, đường Trần Đăng Ninh - Phường Tam Thanh - Thành phố Lạng Sơn - Lạng Sơn	Vận tải hàng hóa bằng đường bộ	4900647492	04-04-2011
Công Ty TNHH Mtv Hồng Phái	Lạng Sơn	Số 11, đường Lê Lợi - Phường Vĩnh Trại - Thành phố Lạng Sơn - Lạng Sơn	Bán buôn vật liệu, thiết bị lắp đặt khác trong xây dựng	4900645985	30-03-2011
Sàn Giao Dịch Bất Động Sản Nam Hoàng Đồng - Chi Nhánh Công Ty CP Sản Xuất Và Thương Mại Lạng Sơn	Lạng Sơn	Tầng 1 số 125, đường Trần Đăng Ninh - Phường Tam Thanh - Thành phố Lạng Sơn - Lạng Sơn	Tư vấn, môi giới, đấu giá bất động sản, đấu giá quyền sử dụng đất	4900102160-002	24-03-2011
Công Ty TNHH Mtv Long Núi Ngọc	Lạng Sơn	Số 15A, đường Mạc Đĩnh Chi - Phường Hoàng Văn Thụ - Thành phố Lạng Sơn - Lạng Sơn	Khai thác gỗ	4900643138	23-03-2011
Công Ty TNHH Bình An Lạng Sơn	Lạng Sơn	Số 616 thôn Vỹ Thượng - Xã Hoàng Đồng - Thành phố Lạng Sơn - Lạng Sơn	Bán buôn ô tô và xe có động cơ khác	4900642751	21-03-2011
Công Ty TNHH Mtv Thương Mại Xuất Nhập Khẩu Khải Lâm	Lạng Sơn	Số 130, đường Trần Phú - Phường Hoàng Văn Thụ - Thành phố Lạng Sơn - Lạng Sơn	Bán lẻ đồ điện gia dụng, giường, tủ, bàn, ghế và đồ nội thất tương tự, đèn và bộ đèn điện, đồ dùng gia đình khác chưa được phân vào đâu trong các cửa hàng chuyên doanh	4900642247	16-03-2011
Công Ty TNHH Vũ Quang Bắc	Lạng Sơn	Số 580 đường Trần Đăng Ninh - Xã Hoàng Đồng - Thành phố Lạng Sơn - Lạng Sơn	Chế biến, bảo quản thịt và các sản phẩm từ thịt	4900641451	14-03-2011
Công Ty TNHH Xây Dựng Minh Uy Lạng Sơn	Lạng Sơn	Thôn Vỹ Hạ - Xã Hoàng Đồng - Thành phố Lạng Sơn - Lạng Sơn	Xây dựng công trình kỹ thuật dân dụng khác	4900640994	11-03-2011
Công Ty TNHH Mtv Anh Dũng Lạng Sơn	Lạng Sơn	Số 52A, đường Lê Quý Đôn, khối 7 - Phường Tam Thanh - Thành phố Lạng Sơn - Lạng Sơn	Xây dựng công trình kỹ thuật dân dụng khác	4900640673	09-03-2011
Công Ty TNHH Mtv Thương Mại Xuất Nhập Khẩu Bảo Ngân	Lạng Sơn	Số 356, đường Bà Triệu - Phường Đông Kinh - Thành phố Lạng Sơn - Lạng Sơn	Bán buôn nông, lâm sản nguyên liệu (trừ gỗ, tre, nứa) và động vật sống	4900640698	09-03-2011
Công Ty TNHH Trường Tín Lạng Sơn	Lạng Sơn	Số 486 đường Bà Triệu - Phường Đông Kinh - Thành phố Lạng Sơn - Lạng Sơn	Khai thác đá, cát, sỏi, đất sét	4900639156	09-03-2011
Công Ty CP Xuất Nhập Khẩu H & C	Lạng Sơn	Số 28, đường 37m, khu đô thị Phú Lộc IV - Phường Hoàng Văn Thụ - Thành phố Lạng Sơn - Lạng Sơn	Bán buôn máy vi tính, thiết bị ngoại vi và phần mềm	4900639075	07-03-2011
Công Ty TNHH Hương Thiên Lộc	Lạng Sơn	Số 9 đường Lý Thường Kiệt - Phường Tam Thanh - Thành phố Lạng Sơn - Lạng Sơn	Sản xuất sản phẩm khác từ gỗ; sản xuất sản phẩm từ tre, nứa, rơm, rạ và vật liệu tết bện	4900637984	28-02-2011
Ngân Hàng Thương Mại Cổ Phần Sài Gòn - Hà Nội, Chi Nhánh Lạng Sơn	Lạng Sơn	Số 20, đường 17/10 - Phường Vĩnh Trại - Thành phố Lạng Sơn - Lạng Sơn	Hoạt động trung gian tiền tệ khác	1800278630-034	28-02-2011
Công Ty TNHH Thương MaÊI Và Vận Chuyển Quốc Tế Bảo Tín	Lạng Sơn	Thôn Vỹ Thượng - Xã Hoàng Đồng - Thành phố Lạng Sơn - Lạng Sơn	Vận tải hành khách đường bộ trong nội thành, ngoại thành (trừ vận tải bằng xe buýt)	4900637617	24-02-2011
Công Ty TNHH Tư Vấn Và Xây Dựng Ngọc Linh	Lạng Sơn	Tổ 5, ngõ 5 đường Phai Vệ - Phường Đông Kinh - Thành phố Lạng Sơn - Lạng Sơn	Hoạt động kiến trúc và tư vấn kỹ thuật có liên quan	4900637744	24-02-2011
Hà Thị Hải Hậu	Lạng Sơn	Số 29 Đường Minh Khai - Thành phố Lạng Sơn - Lạng Sơn	Nhà hàng, quán ăn, hàng ăn uống	4900637624	24-02-2011
Công Ty TNHH Mtv Tm Hường Liên	Lạng Sơn	Số 66, đường 37, khu Đô thị Phú Lộc IV. - Phường Vĩnh Trại - Thành phố Lạng Sơn - Lạng Sơn	Bán lẻ đồ ngũ kim, sơn, kính và thiết bị lắp đặt khác trong xây dựng trong các cửa hàng chuyên doanh	4900636275	18-02-2011
Công Ty TNHH Tm Và Xnk Phương Minh	Lạng Sơn	Số 185, đường Trần Đăng Ninh - Phường Tam Thanh - Thành phố Lạng Sơn - Lạng Sơn	Bán buôn chuyên doanh khác chưa được phân vào đâu	4900636733	16-02-2011
Công Ty TNHH Mtv Thăng Long Ls	Lạng Sơn	Số 36, ngõ 01, đường Ngô Thì Sỹ - Phường Tam Thanh - Thành phố Lạng Sơn - Lạng Sơn	Dịch vụ hỗ trợ tổng hợp	4900636469	14-02-2011
Công Ty CP Khai Thác Khoáng Sản Hoàng Anh Lạng Sơn	Lạng Sơn	Số 14, đường Mạc Đĩnh Chi - Phường Hoàng Văn Thụ - Thành phố Lạng Sơn - Lạng Sơn	Khai thác quặng sắt	4900634052	25-01-2011
Công Ty TNHH Mtv Sản Xuất Bê Tông Đúc Sẵn & Vận Tải Vượng Thiện	Lạng Sơn	Tổ 9, khối 8 - Phường Đông Kinh - Thành phố Lạng Sơn - Lạng Sơn	Sản xuất bê tông và các sản phẩm từ xi măng và thạch cao	4900634133	25-01-2011
Công Ty TNHH Mtv  369	Lạng Sơn	Số 35, đường Hùng Vương - Phường Chi Lăng - Thành phố Lạng Sơn - Lạng Sơn	Xây dựng nhà các loại	4900632062	18-01-2011
Công Ty TNHH Biển Anh	Lạng Sơn	Km 18, Quốc lộ 1A, thôn Trung cấp - Xã Mai Pha - Thành phố Lạng Sơn - Lạng Sơn	Xây dựng nhà các loại	4900632111	18-01-2011
Công Ty CP Đầu Tư Xây Dựng Tân Hợp Phát	Lạng Sơn	Số 97, đường Nguyễn Du - Phường Đông Kinh - Thành phố Lạng Sơn - Lạng Sơn	Xây dựng công trình kỹ thuật dân dụng khác	4900631365	17-01-2011
Công Ty TNHH Kiên Cường Lạng Sơn	Lạng Sơn	Số 01, đường Đinh Tiên Hoàng - Phường Chi Lăng - Thành phố Lạng Sơn - Lạng Sơn	Chăn nuôi gia cầm	4900631132	12-01-2011
Công Ty CP Chiến Thắng	Lạng Sơn	Số 68 đường Vi Đức Thắng - Phường Hoàng Văn Thụ - Thành phố Lạng Sơn - Lạng Sơn	Sản xuất bê tông và các sản phẩm từ xi măng và thạch cao	4900631100	12-01-2011
Công Ty CP Dược Phẩm Lạng Sơn	Lạng Sơn	Số 07, phố Cửa Nam - Phường Chi Lăng - Thành phố Lạng Sơn - Lạng Sơn	Bán buôn đồ dùng khác cho gia đình	4900631118	12-01-2011
Chi nhánh DNTN Sách Thành Nghĩa - Siêu thị Thành Nghĩa Lạng Sơn	Lạng Sơn	Số 03, đường Nguyễn Du - Phường Vĩnh Trại - Thành phố Lạng Sơn - Lạng Sơn	Hoạt động thư viện và lưu trữ	0302840460-020	11-01-2011
Công Ty CP Tư Vấn - Đầu Tư - Xây Dựng K&D	Lạng Sơn	Số 96, đường Lý Thường Kiệt - Xã Hoàng Đồng - Thành phố Lạng Sơn - Lạng Sơn	Hoạt động kiến trúc và tư vấn kỹ thuật có liên quan	4900630033	05-01-2011
Công Ty CP Thương Mại Duy Quang	Lạng Sơn	Số 58, đường Lê Lợi - Phường Vĩnh Trại - Thành phố Lạng Sơn - Lạng Sơn	Vận tải hành khách đường bộ trong nội thành, ngoại thành (trừ vận tải bằng xe buýt)	4900630001	04-01-2011
Công Ty TNHH Mtv Sản Xuất & Thương Mại Hoàng Dương	Lạng Sơn	Số 202, đường Phai Vệ - Phường Đông Kinh - Thành phố Lạng Sơn - Lạng Sơn	Dịch vụ lưu trú ngắn ngày	4900629983	04-01-2011
Văn Phòng Đại Diện Công Ty TNHH Một Thành Viên Khách Sạn Du Lịch Thắng Lợi Tại Lạng Sơn	Lạng Sơn	Số 302, đường Trần Đăng Ninh - Phường Hoàng Văn Thụ - Thành phố Lạng Sơn - Lạng Sơn	Đại lý du lịch	0100106779-005	04-01-2011
Công Ty TNHH Mtv Trường Minh	Lạng Sơn	Số 182, đường Lê Lai - Phường Hoàng Văn Thụ - Thành phố Lạng Sơn - Lạng Sơn	Bán buôn thực phẩm	4900629461	30-12-2010
Công Ty CP Iq Việt Nam	Lạng Sơn	Số 9, đường Mỹ Sơn - Phường Vĩnh Trại - Thành phố Lạng Sơn - Lạng Sơn	Tổ chức giới thiệu và xúc tiến thương mại	4900629239	27-12-2010
Trung tâm Công nghệ thông tin và truyền thông Lạng Sơn	Lạng Sơn	Số 01, Phố Mai Thế Chuẩn - Phường Chi Lăng - Thành phố Lạng Sơn - Lạng Sơn	NÔNG NGHIỆP, LÂM NGHIỆP VÀ THUỶ SẢN	4900629398	27-12-2010
Công Ty CP Thương Mại Đại Thành Qua Vina	Lạng Sơn	Số 226, thôn Hoàng Thanh - Xã Hoàng Đồng - Thành phố Lạng Sơn - Lạng Sơn	Bán buôn nông, lâm sản nguyên liệu (trừ gỗ, tre, nứa) và động vật sống	4900626100	22-12-2010
Doanh Nghiệp Tư Nhân Phương Nga	Lạng Sơn	Số 9, khối Hoàng Hoa Thám, đường Chùa Tiên - Phường Chi Lăng - Thành phố Lạng Sơn - Lạng Sơn	Hoạt động cấp tín dụng khác	4900625428	20-12-2010
Công Ty TNHH Thương Mại Haru	Lạng Sơn	Số 132, đường Trần Quang Khải - Phường Chi Lăng - Thành phố Lạng Sơn - Lạng Sơn	Bán buôn vật liệu, thiết bị lắp đặt khác trong xây dựng	4900624350	15-12-2010
Công Ty CP Xây Dựng Và Thương Mại Việt Hà	Lạng Sơn	Thôn Mai Thành - Xã Mai Pha - Thành phố Lạng Sơn - Lạng Sơn	Xây dựng nhà các loại	4900624343	14-12-2010
Công Ty CP Liên Doanh Non Nước Dmc	Lạng Sơn	Gác 2, số nhà 16, đường Mỹ Sơn - Phường Vĩnh Trại - Thành phố Lạng Sơn - Lạng Sơn	Sản xuất bê tông và các sản phẩm từ xi măng và thạch cao	4900623283	10-12-2010
Công Ty TNHH Mtv Ngọc Sơn	Lạng Sơn	Số 01, ngõ 04, đường Lê Lợi - Phường Vĩnh Trại - Thành phố Lạng Sơn - Lạng Sơn	Bán buôn vật liệu, thiết bị lắp đặt khác trong xây dựng	4900622628	10-12-2010
Chi Nhánh Công Ty TNHH Một Thành Viên Phân Bón Việt Hoa	Lạng Sơn	Số 34B, đường Thân Cảnh Phúc - Phường Hoàng Văn Thụ - Thành phố Lạng Sơn - Lạng Sơn	Sản xuất phân bón và hợp chất ni tơ	2700560265-001	10-12-2010
Công ty TNHH Thương mại và Sản xuất Hưng Long Lạng Sơn	Lạng Sơn	Thôn Pàn Pe, xã Hoàng Đồng, TP Lạng Sơn. - Phường Tam Thanh - Thành phố Lạng Sơn - Lạng Sơn	Bán buôn máy móc, thiết bị và phụ tùng máy khác	4900622579	08-12-2010
Doanh Nghiệp Tư Nhân Bảo Linh	Lạng Sơn	Số 594, đường Trần Đăng Ninh, thôn Vỹ Thượng - Xã Hoàng Đồng - Thành phố Lạng Sơn - Lạng Sơn	Đại lý, môi giới, đấu giá	4900622191	03-12-2010
Công Ty TNHH Mtv Hùng Nga	Lạng Sơn	Thôn Bản Viển - Xã Hoàng Đồng - Thành phố Lạng Sơn - Lạng Sơn	Vệ sinh nhà cửa và các công trình khác	4900619294	24-11-2010
Công Ty TNHH Hoa Cây Cảnh Việt Trung	Lạng Sơn	Số 118, đường Ngô Quyền - Phường Đông Kinh - Thành phố Lạng Sơn - Lạng Sơn	Bán buôn nông, lâm sản nguyên liệu (trừ gỗ, tre, nứa) và động vật sống	4900618879	18-11-2010
Xí Nghiệp Rượu Mẫu Sơn - Chi Nhánh Công Ty CP Du Lịch Và Xuất Nhập Khẩu Lạng Sơn	Lạng Sơn	Số 88, đường Bắc Sơn - Thành phố Lạng Sơn - Lạng Sơn	Chưng, tinh cất và pha chế các loại rượu mạnh	4900101456-017	18-11-2010
Siêu Thị Bắc Sơn - Chi Nhánh Công Ty CP Du Lịch Và Xuất Nhập Khẩu Lạng Sơn	Lạng Sơn	Số 41, đường Lê Lợi - Phường Vĩnh Trại - Thành phố Lạng Sơn - Lạng Sơn	Bán lẻ khác trong các cửa hàng kinh doanh tổng hợp	4900101456-018	18-11-2010
Công Ty TNHH Nhân Hòa	Lạng Sơn	Số 68, phố Phai Luông 6, khu tái định cư Phai Luông - Phường Chi Lăng - Thành phố Lạng Sơn - Lạng Sơn	Xây dựng nhà các loại	4900618660	17-11-2010
Trung Tâm  Điều Hành Hướng Dẫn Du Lịch - Chi Nhánh Công Ty CP Du Lịch Và Xuất Nhập Khẩu Lạng Sơn	Lạng Sơn	Số 9, đường Trần Hưng Đạo - Phường Chi Lăng - Thành phố Lạng Sơn - Lạng Sơn	Điều hành tua du lịch	4900101456-014	17-11-2010
Trung Tâm Thương Mại Bắc Sơn - Chi Nhánh Công Ty CP Du Lịch Và Xuất Nhập Khẩu Lạng Sơn	Lạng Sơn	Số 41, đường Lê Lợi - Phường Vĩnh Trại - Thành phố Lạng Sơn - Lạng Sơn	Kinh doanh bất động sản, quyền sử dụng đất thuộc chủ sở hữu, chủ sử dụng hoặc đi thuê	4900101456-015	17-11-2010
Khách Sạn Hoa Sim - Chi Nhánh Công Ty CP Du Lịch Và Xuất Nhập Khẩu Lạng Sơn	Lạng Sơn	Số 1A, đường Nguyễn Thái Học - Phường Chi Lăng - Thành phố Lạng Sơn - Lạng Sơn	Dịch vụ lưu trú ngắn ngày	4900101456-016	17-11-2010
Nhà Hàng Nam Kai - Chi Nhánh Công Ty CP Du Lịch Và Xuất Nhập Khẩu Lạng Sơn	Lạng Sơn	Số 53 đường Lương Văn Chi - Phường Hoàng Văn Thụ - Thành phố Lạng Sơn - Lạng Sơn	Nhà hàng và các dịch vụ ăn uống phục vụ lưu động	4900101456-019	17-11-2010
Công Ty TNHH Tiến Minh	Lạng Sơn	Số 240, đường Trần Đăng Ninh - Phường Hoàng Văn Thụ - Thành phố Lạng Sơn - Lạng Sơn	Bán buôn nông, lâm sản nguyên liệu (trừ gỗ, tre, nứa) và động vật sống	4900618413	16-11-2010
Công Ty Cổ Phần An Thắng	Lạng Sơn	Số 30, đường Trần Hưng Đạo - Phường Chi Lăng - Thành phố Lạng Sơn - Lạng Sơn	Khai thác đá, cát, sỏi, đất sét	4900617924	11-11-2010
Công Ty TNHH Mtv Vận Tải Và Thương Mại Quang Minh	Lạng Sơn	Số 38, đường Trần Hưng Đạo - Phường Chi Lăng - Thành phố Lạng Sơn - Lạng Sơn	Bán buôn nông, lâm sản nguyên liệu (trừ gỗ, tre, nứa) và động vật sống	4900617025	04-11-2010
Công Ty TNHH Mtv Thương Mại Dịch Vụ Xuất Nhập Khẩu An Phát	Lạng Sơn	Số 145, đường Lê Hồng Phong - Phường Tam Thanh - Thành phố Lạng Sơn - Lạng Sơn	Bán buôn vải, hàng may sẵn, giày dép	4900616575	01-11-2010
Công Ty TNHH Thiên Phong	Lạng Sơn	Số 40, Đường Lê Lợi - Phường Vĩnh Trại - Thành phố Lạng Sơn - Lạng Sơn	Bán buôn thực phẩm	4900615437	28-10-2010
Doanh Nghiệp Tư Nhân Chí Dũng	Lạng Sơn	Số 06, khối 06, đường Tam Thanh - Phường Tam Thanh - Thành phố Lạng Sơn - Lạng Sơn	Vận tải hàng hóa bằng đường bộ	4900615363	27-10-2010
Công Ty TNHH Mtv Song Giáp	Lạng Sơn	Số 317, đường Trần Đăng Ninh - Phường Tam Thanh - Thành phố Lạng Sơn - Lạng Sơn	Bán buôn thực phẩm	4900615042	26-10-2010
Công Ty TNHH âu Việt	Lạng Sơn	Khu tái định cư Phai Luông - Phường Chi Lăng - Thành phố Lạng Sơn - Lạng Sơn	Xử lý ô nhiễm và hoạt động quản lý chất thải khác	4900615074	26-10-2010
Công Ty TNHH Minh Đức Lạng Sơn	Lạng Sơn	Khu tái định cư, khối 9, đường Bà Triệu - Phường Đông Kinh - Thành phố Lạng Sơn - Lạng Sơn	Xử lý ô nhiễm và hoạt động quản lý chất thải khác	4900615081	26-10-2010
Công Ty TNHH Mtv Thương Mại Hồng Ngọc	Lạng Sơn	Số 5B, đường Tô Thị - Phường Tam Thanh - Thành phố Lạng Sơn - Lạng Sơn	Sản xuất sản phẩm từ plastic	4900615099	25-10-2010
Công Ty TNHH Hàng Gia Dụng An Toàn Việt Nam	Lạng Sơn	Số nhà 15, phố Muối - Phường Tam Thanh - Thành phố Lạng Sơn - Lạng Sơn	Sản xuất đồ điện dân dụng	4900615067	25-10-2010
Ngân Hàng Thương Mại Cổ Phần Bưu Điện Liên Việt - Chi Nhánh Lạng Sơn	Lạng Sơn	Số 01, đường Tam Thanh - Phường Tam Thanh - Thành phố Lạng Sơn - Lạng Sơn	Hoạt động trung gian tiền tệ khác	6300048638-013	21-10-2010
Công Ty TNHH Mtv Nguyên Phát	Lạng Sơn	Số 79, đường Bông Lau, tổ 1, khối 14 - Phường Hoàng Văn Thụ - Thành phố Lạng Sơn - Lạng Sơn	Quảng cáo	4900613888	19-10-2010
Công Ty CP Tuấn Lộc	Lạng Sơn	Số 45, đường Bà Triệu - Phường Hoàng Văn Thụ - Thành phố Lạng Sơn - Lạng Sơn	Sản xuất vật liệu xây dựng từ đất sét	4900613895	19-10-2010
Chi Nhánh Công Ty TNHH Nhà Nước Một Thành Viên Thương Mại Và Xuất Nhập Khẩu Viettel Tại Lạng Sơn	Lạng Sơn	Số 19, 21, 23, 25 đường Lê Lợi, - Phường Vĩnh Trại - Thành phố Lạng Sơn - Lạng Sơn	Bán buôn thiết bị và linh kiện điện tử, viễn thông	0104831030-005	18-10-2010
Công Ty CP Đầu Tư Xây Dựng Và Thương Mại Trường Lộc-Chi Nhánh Tỉnh Lạng Sơn	Lạng Sơn	Tổ 3, khối 14, đường Bông Lau - Phường Hoàng Văn Thụ - Thành phố Lạng Sơn - Lạng Sơn	Xây dựng công trình kỹ thuật dân dụng	2400372052-001	18-10-2010
Công Ty TNHH Khoáng Sản Minh Long	Lạng Sơn	Số 77, đường Tam Thanh - Phường Tam Thanh - Thành phố Lạng Sơn - Lạng Sơn	Khai thác quặng sắt	4900613447	14-10-2010
Công Ty Cổ Phần Kcf	Lạng Sơn	Số 26, Thôn Hoàng Thanh - Xã Hoàng Đồng - Thành phố Lạng Sơn - Lạng Sơn	Bán buôn nông, lâm sản nguyên liệu (trừ gỗ, tre, nứa) và động vật sống	4900613422	14-10-2010
Công Ty TNHH Kiểm Toán Và Định Giá Thăng Long - T.D.K - Chi Nhánh Đông Bắc	Lạng Sơn	Số 319, đường Bà Triệu - Phường Vĩnh Trại - Thành phố Lạng Sơn - Lạng Sơn	Hoạt động liên quan đến kế toán, kiểm toán và tư vấn về thuế	0104779158-003	14-10-2010
Công Ty TNHH Mtv T&C	Lạng Sơn	Số 57, đường Phai Vệ - Phường Vĩnh Trại - Thành phố Lạng Sơn - Lạng Sơn	Dịch vụ lưu trú ngắn ngày	4900612612	07-10-2010
Công Ty TNHH Minh An	Lạng Sơn	Số 123, ngõ 10A đường Bắc Sơn - Phường Hoàng Văn Thụ - Thành phố Lạng Sơn - Lạng Sơn	Xử lý ô nhiễm và hoạt động quản lý chất thải khác	4900612637	07-10-2010
Công Ty CP Thương Mại Và Dịch Vụ Hoàng Gia	Lạng Sơn	Số 355, đường Bà Triệu - Phường Vĩnh Trại - Thành phố Lạng Sơn - Lạng Sơn	Bán lẻ sách, báo, tạp chí văn phòng phẩm trong các cửa hàng chuyên doanh	4900612443	05-10-2010
Công Ty TNHH Tín Việt	Lạng Sơn	Số 11, đường Trần Đăng Ninh - Phường Tam Thanh - Thành phố Lạng Sơn - Lạng Sơn	Bán buôn nông, lâm sản nguyên liệu (trừ gỗ, tre, nứa) và động vật sống	4900612450	05-10-2010
Công Ty CP Lộc Hải Sơn	Lạng Sơn	Số 17, đường Phai Vệ - Phường Vĩnh Trại - Thành phố Lạng Sơn - Lạng Sơn	Bán buôn nông, lâm sản nguyên liệu (trừ gỗ, tre, nứa) và động vật sống	4900612475	05-10-2010
Công Ty TNHH Thương Mại Cường Thịnh	Lạng Sơn	Số 40/5, đường Lê Lợi, khối 10 - Phường Vĩnh Trại - Thành phố Lạng Sơn - Lạng Sơn	Bán buôn nông, lâm sản nguyên liệu (trừ gỗ, tre, nứa) và động vật sống	4900612203	01-10-2010
Công Ty TNHH Mtv Xây Dựng Và Thương Mại Bảo Luận	Lạng Sơn	Số 11, quốc lộ 1A (cách ngã tư Mỹ Sơn 30m theo hướng đi Đồng - Phường Vĩnh Trại - Thành phố Lạng Sơn - Lạng Sơn	Xây dựng nhà các loại	4900611873	28-09-2010
Công Ty CP Thương Mại Trà My	Lạng Sơn	Số 118 B, đường Trần Quang Khải - Phường Chi Lăng - Thành phố Lạng Sơn - Lạng Sơn	Bán buôn chuyên doanh khác chưa được phân vào đâu	4900611880	28-09-2010
Công Ty CP Thương Mại Phúc Anh	Lạng Sơn	Số 04, dãy LKD2, khu đô thị Phú Lộc 4 - Phường Vĩnh Trại - Thành phố Lạng Sơn - Lạng Sơn	Đại lý, môi giới, đấu giá	4900611898	28-09-2010
Công Ty CP Tin Học Và Dịch Vụ Văn Phòng Tiến Hùng	Lạng Sơn	Số 117, đường Phai Vệ - Phường Đông Kinh - Thành phố Lạng Sơn - Lạng Sơn	Bán buôn máy vi tính, thiết bị ngoại vi và phần mềm	4900610710	15-09-2010
Công Ty TNHH Kỹ Thuật Công Nghệ Gia Phong	Lạng Sơn	Số 51, đường Ngô Quyền - Phường Vĩnh Trại - Thành phố Lạng Sơn - Lạng Sơn	Bán buôn máy vi tính, thiết bị ngoại vi và phần mềm	4900609458	11-09-2010
Chi Nhánh Công Ty CP Thái Dương Tại Lạng Sơn	Lạng Sơn	Ngã tư Phai Trần - Xã Hoàng Đồng - Thành phố Lạng Sơn - Lạng Sơn	Bán buôn ô tô và xe có động cơ khác	4900255745-001	11-09-2010
Công Ty CP Thương Mại Phú Lâm	Lạng Sơn	Thôn Vỹ Thượng - Xã Hoàng Đồng - Thành phố Lạng Sơn - Lạng Sơn	Nhân và chăm sóc cây giống nông nghiệp	4900609472	11-09-2010
Chi nhánh Công ty cổ phần tư vấn thiết kế công trình xây dựng Hải Phòng tại Lạng Sơn	Lạng Sơn	Số 9 đường Hùng Vương - Phường Chi Lăng - Thành phố Lạng Sơn - Lạng Sơn	Chuẩn bị mặt bằng	0200156484-002	09-09-2010
Chi Nhánh Tư Vấn Xây Dựng Công Trình - Công Ty Cổ Phần Cấp Thoát Nước Lạng Sơn	Lạng Sơn	Số 14/10, đường Lê Đại Hành - Phường Đông Kinh - Thành phố Lạng Sơn - Lạng Sơn	Hoạt động kiến trúc và tư vấn kỹ thuật có liên quan	4900101738-009	07-09-2010
Trung tâm Kiểm nghiệm Dược phẩm và Mỹ phẩm Lạng Sơn	Lạng Sơn	Số 160, đường Nguyễn Du - Phường Đông Kinh - Thành phố Lạng Sơn - Lạng Sơn	Hoạt động y tế	4900607186	26-08-2010
Công ty TNHH MTV Gia Đình	Lạng Sơn	Thôn Khòn Khuyên, đường Hùng Vương - Xã Mai Pha - Thành phố Lạng Sơn - Lạng Sơn	Bán buôn tổng hợp	4900606714	23-08-2010
Công Ty TNHH Mtv Hoàng Chí Linh	Lạng Sơn	Ngõ 1, Thôn Đồng én - Thành phố Lạng Sơn - Lạng Sơn	Bán buôn tổng hợp	4900605735	18-08-2010
Công Ty TNHH Thương Mại Và Dịch Vụ Trường Vinh	Lạng Sơn	Số 23 đường Lê Lai - Phường Hoàng Văn Thụ - Thành phố Lạng Sơn - Lạng Sơn	Bán buôn nông, lâm sản nguyên liệu (trừ gỗ, tre, nứa) và động vật sống	4900604555	12-08-2010
