Công Ty TNHH Mtv Xuất Nhập Khẩu C-v-h Lạng Sơn	Lạng Sơn	Số 177, Khu Phiêng Quăn, Thị Trấn Lộc Bình, Huyện Lộc Bình, Tỉnh Lạng Sơn	Hoạt động dịch vụ hỗ trợ kinh doanh khác còn lại chưa được phân vào đâu	4900848664	16-04-2019
Công Ty TNHH Mtv Hường Quang	Lạng Sơn	Khu II, Thị Trấn Na Dương, Huyện Lộc Bình, Tỉnh Lạng Sơn	Bán buôn nông, lâm sản nguyên liệu (trừ gỗ, tre, nứa) và động vật sống	4900832294	20-07-2018
Công Ty TNHH Mtv Xuất Nhập Khẩu Hoàng Xanh	Lạng Sơn	Số nhà 31, Khu Nhà Thờ, Thị Trấn Lộc Bình, Huyện Lộc Bình, Tỉnh Lạng Sơn	Bán buôn nông, lâm sản nguyên liệu (trừ gỗ, tre, nứa) và động vật sống	4900827720	23-05-2018
Công Ty Cổ Phần Anh Tùng Ls	Lạng Sơn	Thôn Chi Ma, Xã Yên Khoái, Huyện Lộc Bình, Tỉnh Lạng Sơn	Hoạt động dịch vụ hỗ trợ kinh doanh khác còn lại chưa được phân vào đâu	4900827470	17-05-2018
Công Ty TNHH Mtv Thành Hưng Hh Lạng Sơn	Lạng Sơn	Số nhà 27, khu 8, Thị Trấn Na Dương, Huyện Lộc Bình, Tỉnh Lạng Sơn	Xây dựng nhà các loại	4900827008	11-05-2018
Công Ty TNHH Mtv Lâm Sản Thanh Thủy	Lạng Sơn	Khu Phố 1, Thị Trấn Na Dương, Huyện Lộc Bình, Tỉnh Lạng Sơn	Bán buôn máy móc, thiết bị và phụ tùng máy khác	4900823532	05-04-2018
Công Ty TNHH Mtv Hương Lộc Sơn	Lạng Sơn	Số 168 Khu Minh Khai, Thị Trấn Lộc Bình, Huyện Lộc Bình, Tỉnh Lạng Sơn	Sản xuất các sản phẩm khác từ giấy và bìa chưa được phân vào đâu	4900822930	02-04-2018
Công Ty TNHH Kinh Doanh Toàn Gia	Lạng Sơn	Khu 4, Thị Trấn Na Dương, Huyện Lộc Bình, Tỉnh Lạng Sơn	Nhà hàng và các dịch vụ ăn uống phục vụ lưu động	4900823067	02-04-2018
Công Ty TNHH Dịch Vụ Xnk Vũ Gia	Lạng Sơn	Số 2, phố Hòa Bình, Thị Trấn Lộc Bình, Huyện Lộc Bình, Tỉnh Lạng Sơn	Hoạt động dịch vụ hỗ trợ kinh doanh khác còn lại chưa được phân vào đâu	4900821398	08-03-2018
Cửa Hàng Đồng Hồ - Chi Nhánh Công Ty TNHH Mtv Thương Mại Tns	Lạng Sơn	Số 279, Khu Lao Động, Thị Trấn Lộc Bình, Huyện Lộc Bình, Tỉnh Lạng Sơn	Bán buôn đồ dùng khác cho gia đình	4900793285-001	06-02-2018
Công Ty TNHH Tuổi Trẻ Hoàng Ngọc	Lạng Sơn	thôn Khòn Sè, Xã Sàn Viên, Huyện Lộc Bình, Tỉnh Lạng Sơn	Bán buôn vật liệu, thiết bị lắp đặt khác trong xây dựng	4900818821	15-01-2018
Công Ty TNHH Mtv Kiêm Thụ	Lạng Sơn	Thôn Khòn Miện, Xã Đồng Bục, Huyện Lộc Bình, Tỉnh Lạng Sơn	Cưa, xẻ, bào gỗ và bảo quản gỗ	4900818701	11-01-2018
Công Ty TNHH Mtv Xăng Dầu Hoàng Hiền	Lạng Sơn	Số 04A, đường Lê Thành Tông, Thị Trấn Na Dương, Huyện Lộc Bình, Tỉnh Lạng Sơn	Bán buôn nhiên liệu rắn, lỏng, khí và các sản phẩm liên quan	4900814231	17-10-2017
Công Ty TNHH Mtv Tlđ Ls	Lạng Sơn	Số 143, Khu 5, Thị Trấn Na Dương, Huyện Lộc Bình, Tỉnh Lạng Sơn	Xây dựng nhà các loại	4900813855	03-10-2017
Công Ty TNHH Mtv Đức Phong Na Dương	Lạng Sơn	Khu 6, Thị Trấn Na Dương, Huyện Lộc Bình, Tỉnh Lạng Sơn	Trồng cây lâu năm khác	4900812259	05-08-2017
Công Ty TNHH Tư Vấn Đầu Tư Xây Dựng Nhật Quang	Lạng Sơn	Khu Bản Kho, Thị Trấn Lộc Bình, Huyện Lộc Bình, Tỉnh Lạng Sơn	Hoạt động kiến trúc và tư vấn kỹ thuật có liên quan	4900810734	27-06-2017
Doanh Nghiệp Tư Nhân Vàng Bạc Phùng Đức Giáp	Lạng Sơn	Số 108, phố Lao Động, Thị Trấn Lộc Bình, Huyện Lộc Bình, Tỉnh Lạng Sơn	Bán lẻ hàng hóa khác mới trong các cửa hàng chuyên doanh	4900810491	20-06-2017
Công Ty Cổ Phần Dược Liệu Mẫu Sơn	Lạng Sơn	Thôn Bó Pằm, Xã Mẫu Sơn, Huyện Lộc Bình, Tỉnh Lạng Sơn	Trồng cây gia vị, cây dược liệu	4900810124	12-06-2017
Công Ty TNHH Mtv Thành Công Lạng Sơn	Lạng Sơn	Thôn Bản Cảng, Xã Khuất Xá, Huyện Lộc Bình, Tỉnh Lạng Sơn	Bán buôn vật liệu, thiết bị lắp đặt khác trong xây dựng	4900809552	29-05-2017
Công Ty TNHH Mtv Quyết Học Lạng Sơn	Lạng Sơn	Thôn Pò Đồn, Xã Xuân Dương, Huyện Lộc Bình, Tỉnh Lạng Sơn	Sản xuất bê tông và các sản phẩm từ xi măng và thạch cao	4900809489	25-05-2017
Công Ty TNHH Mtv Đầu Tư Xây Dựng Và Thương Mại Sơn Hồng	Lạng Sơn	Số 67, Khu Bản Kho, Thị Trấn Lộc Bình, Huyện Lộc Bình, Tỉnh Lạng Sơn	Xây dựng công trình kỹ thuật dân dụng khác	4900808220	19-04-2017
Công Ty TNHH Mtv Tm Xnk Hà Bắc	Lạng Sơn	Thôn Chi Ma, Xã Yên Khoái, Huyện Lộc Bình, Tỉnh Lạng Sơn	Bán buôn nông, lâm sản nguyên liệu (trừ gỗ, tre, nứa) và động vật sống	4900802733	20-12-2016
Doanh Nghiệp Tư Nhân Tiệm Vàng Đá Quý Kim Sơn	Lạng Sơn	Số 16, đường Cách Mạng Tháng Tám, khu Nhà Thờ - Thị trấn Lộc Bình - Huyện Lộc Bình - Lạng Sơn	Bán lẻ hàng hóa khác mới trong các cửa hàng chuyên doanh	4900800817	22-11-2016
Công Ty Cổ Phần Núi Tuyết Mẫu Sơn	Lạng Sơn	Khu Du lịch Mẫu Sơn - Xã Mẫu Sơn - Huyện Lộc Bình - Lạng Sơn	Xây dựng nhà các loại	4900800165	25-10-2016
Công Ty TNHH Mtv Xnk Sâm Hảo	Lạng Sơn	Thôn Cốc Nhãn - Xã Yên Khoái - Huyện Lộc Bình - Lạng Sơn	Bán lẻ đồ điện gia dụng, giường, tủ, bàn, ghế và đồ nội thất tương tự, đèn và bộ đèn điện, đồ dùng gia đình khác chưa được phân vào đâu trong các cửa hàng chuyên doanh	4900799826	07-10-2016
Công Ty TNHH Lộc Bình Motor	Lạng Sơn	Số 259, đường Cách mạng tháng 8, khu Lao Động - Thị trấn Lộc Bình - Huyện Lộc Bình - Lạng Sơn		4900796906	11-07-2016
Công Ty Cổ Phần Đầu Tư Và Thương Mại Duy Đức	Lạng Sơn	Cửa khẩu Chi Ma - Xã Yên Khoái - Huyện Lộc Bình - Lạng Sơn	Bán buôn nông, lâm sản nguyên liệu (trừ gỗ, tre, nứa) và động vật sống	4900796335	04-07-2016
Công Ty TNHH Mtv Xăng Dầu Na Dương	Lạng Sơn	Khu Sơn Hà - Thị trấn Na Dương - Huyện Lộc Bình - Lạng Sơn	Bán buôn nhiên liệu rắn, lỏng, khí và các sản phẩm liên quan	4900793006	24-05-2016
Công Ty TNHH Mtv Đức Kiên Lạng Sơn	Lạng Sơn	Số 11, khu Nhà Thờ - Thị trấn Lộc Bình - Huyện Lộc Bình - Lạng Sơn	Bán lẻ hàng hóa khác mới trong các cửa hàng chuyên doanh	4900792919	19-05-2016
Doanh Nghiệp Tư Nhân Sản Xuất Và Thương Mại Xuất Nhập Khẩu Nam Dương	Lạng Sơn	Khu Nam Hà - Thị trấn Na Dương - Huyện Lộc Bình - Lạng Sơn	Sản xuất bê tông và các sản phẩm từ xi măng và thạch cao	4900792926	19-05-2016
Công Ty TNHH Mtv Dũng Nga Lạng Sơn	Lạng Sơn	Khu Hòa Bình - Thị trấn Lộc Bình - Huyện Lộc Bình - Lạng Sơn	Bán lẻ hàng hóa khác mới trong các cửa hàng chuyên doanh	4900792796	16-05-2016
Trường Mầm Non Xã Bằng Khánh	Lạng Sơn	Xã Bằng Khanh - Xã Bằng Khánh - Huyện Lộc Bình - Lạng Sơn	Giáo dục mầm non	4900792235	12-04-2016
Công Ty TNHH Mtv Vlxd Thùy Liên	Lạng Sơn	Khu Lao động - Thị trấn Lộc Bình - Huyện Lộc Bình - Lạng Sơn	Bán buôn vật liệu, thiết bị lắp đặt khác trong xây dựng	4900792186	08-04-2016
Công Ty Cổ Phần Đầu Tư Và Phát Triển Xây Dựng Lộc Bình	Lạng Sơn	Số 83, Khu Chộc Vằng - Thị trấn Lộc Bình - Huyện Lộc Bình - Lạng Sơn		4900790950	10-03-2016
Công Ty TNHH Mtv  Du Lịch - Dịch Vụ Bảo Sơn	Lạng Sơn	Nhà nghỉ 9 gian, Khu du lịch Mẫu Sơn - Xã Mẫu Sơn - Huyện Lộc Bình - Lạng Sơn	Dịch vụ lưu trú ngắn ngày	4900788616	25-12-2015
Công Ty TNHH Mtv Đầu Tư Phát Triển Hoàng Hưng	Lạng Sơn	Bãi xe Tuấn Minh, khu cửa khẩu Chi Ma - Xã Yên Khoái - Huyện Lộc Bình - Lạng Sơn	Bán buôn tổng hợp	4900788503	23-12-2015
Trường Mầm non xã Xuân Mãn	Lạng Sơn	Bản Mặn - Xã Xuân Mãn - Huyện Lộc Bình - Lạng Sơn	Bán lẻ (trừ ô tô, mô tô, xe máy và xe có động cơ khác)	4900787771	07-12-2015
Công Ty TNHH Mtv Tm Và Xnk Kim Sơn	Lạng Sơn	Khu nhà thờ - Thị trấn Lộc Bình - Huyện Lộc Bình - Lạng Sơn	Bán lẻ hàng hóa khác mới trong các cửa hàng chuyên doanh	4900787637	01-12-2015
Ban Quản lý dự án Đầu tư Xây dựng huyện Lộc Bình	Lạng Sơn	Khu Hòa Bình - Thị trấn Lộc Bình - Huyện Lộc Bình - Lạng Sơn	Bán lẻ (trừ ô tô, mô tô, xe máy và xe có động cơ khác)	4900787073	10-11-2015
Công Ty TNHH Thương Mại Và Xuất Nhập Khẩu Tuấn Sơn	Lạng Sơn	Cửa khẩu Chi Ma - Xã Yên Khoái - Huyện Lộc Bình - Lạng Sơn	Kho bãi và lưu giữ hàng hóa	4900786591	27-10-2015
Trường Mầm non xã Minh Phát	Lạng Sơn	Nà Noong - Xã Minh Phát - Huyện Lộc Bình - Lạng Sơn	Bán lẻ (trừ ô tô, mô tô, xe máy và xe có động cơ khác)	4900786633	27-10-2015
Doanh Nghiệp Tư Nhân Nhà Nghỉ Đức Hậu	Lạng Sơn	Thôn Lăng Xè - Xã Đồng Bục - Huyện Lộc Bình - Lạng Sơn	Dịch vụ lưu trú ngắn ngày	4900785904	06-10-2015
Hợp tác xã dịch vụ Nông nghiệp Đồng bục	Lạng Sơn	xã Đồng Bục, huyện Lộc Bình, tỉnh Lạng Sơn - Xã Đồng Bục - Huyện Lộc Bình - Lạng Sơn	Nông nghiệp và hoạt động dịch vụ có liên quan	4900783537	20-07-2015
Công Ty Cổ Phần Thương Mại Quốc Tế Thăng Long Lạng Sơn	Lạng Sơn	Khu liên hiệp Kinh tế cửa khẩu Chi Ma - Xã Yên Khoái - Huyện Lộc Bình - Lạng Sơn	Vận tải hàng hóa bằng đường bộ	4900782886	11-06-2015
Công Ty TNHH Mtv Lộc Chi Phát	Lạng Sơn	Khu kinh tế cửa khẩu Chi Ma - Xã Yên Khoái - Huyện Lộc Bình - Lạng Sơn	Hoạt động dịch vụ hỗ trợ kinh doanh khác còn lại chưa được phân vào đâu	4900782244	08-05-2015
Công Ty TNHH Mtv Đại Phát Lộc 68	Lạng Sơn	Số 78, khu Na Dương Bản - Thị trấn Na Dương - Huyện Lộc Bình - Lạng Sơn	Bán buôn tổng hợp	4900781272	31-03-2015
Trường Mầm Non Xã Bằng Khánh	Lạng Sơn	Thôn Khòn Khoang - Xã Bằng Khánh - Huyện Lộc Bình - Lạng Sơn	Giáo dục mầm non	4900781233	30-03-2015
Văn Phòng Đại Diện Công Ty Cổ Phần Vận Tải Và Xuất Nhập Khẩu Hgb	Lạng Sơn	Số 75 Khu Lao Động - Thị trấn Lộc Bình - Huyện Lộc Bình - Lạng Sơn	Vận tải hàng hóa bằng đường bộ	4900755586-001	25-03-2015
Công Ty TNHH Mtv Hon Chi Ma	Lạng Sơn	Khu vực cửa khẩu Chi Ma - Huyện Lộc Bình - Lạng Sơn	Bán buôn tổng hợp	4900779315	31-12-2014
Doanh Nghiệp Tư Nhân Bùi Trường Giang	Lạng Sơn	Số 91, phố Lao Động - Huyện Lộc Bình - Lạng Sơn	Bán lẻ hàng hóa khác mới trong các cửa hàng chuyên doanh	4900779192	29-12-2014
Công Ty TNHH Thương Mại Thái - Long	Lạng Sơn	Thôn Bản Khiếng - Huyện Lộc Bình - Lạng Sơn	Sản xuất đồ uống không cồn, nước khoáng	4900778720	18-12-2014
Công Ty TNHH Thương Mại Tổng Hợp Trường Xuân Ngọc	Lạng Sơn	Cửa khẩu Chi Ma, thôn Chi Ma - Xã Yên Khoái - Huyện Lộc Bình - Lạng Sơn	Bán buôn tổng hợp	4900777808	01-12-2014
Công Ty TNHH Thương Mại Và Xây Dựng Quang Thành	Lạng Sơn	Số 120, Khu Hòa Bình - Thị trấn Lộc Bình - Huyện Lộc Bình - Lạng Sơn	Xây dựng nhà các loại	4900777188	11-11-2014
Công Ty TNHH Mtv Thương Mại Xuất Nhập Khẩu Việt Đức	Lạng Sơn	Số 03, khu phố 1 - Huyện Lộc Bình - Lạng Sơn	Bán buôn nông, lâm sản nguyên liệu (trừ gỗ, tre, nứa) và động vật sống	4900775303	31-07-2014
Phúc Thoạn	Lạng Sơn	201 - Huyện Lộc Bình - Lạng Sơn	Photo, chuẩn bị tài liệu	4900775222	24-07-2014
Công Ty TNHH Hòa Thuận Hưng	Lạng Sơn	Số 78, khu Na Dương Bản - Huyện Lộc Bình - Lạng Sơn	Bán buôn vật liệu, thiết bị lắp đặt khác trong xây dựng	4900774966	15-07-2014
Công Ty TNHH Mtv Lâm Thao Ls	Lạng Sơn	Số 102, khu Hòa Bình - Huyện Lộc Bình - Lạng Sơn	Xây dựng công trình kỹ thuật dân dụng khác	4900774620	03-07-2014
Xí Nghiệp Khai Thác Công Trình Thủy Lợi Lộc Bình - Chi Nhánh Công Ty TNHH Mtv Khai Thác Công Trình T	Lạng Sơn	Số 21, khu Bản Kho - Thị trấn Lộc Bình - Huyện Lộc Bình - Lạng Sơn	Xây dựng công trình công ích	4900100357-018	18-06-2014
Công Ty TNHH Mtv Triệu Hoa	Lạng Sơn	Khu Tái định cư cửa khẩu Chi Ma - Xã Yên Khoái - Huyện Lộc Bình - Lạng Sơn	Bán buôn nông, lâm sản nguyên liệu (trừ gỗ, tre, nứa) và động vật sống	4900774349	17-06-2014
Trung Tâm Máy Tính Lộc Bình	Lạng Sơn	30 Khu Minh Khai - Huyện Lộc Bình - Lạng Sơn	Sửa chữa máy vi tính, đồ dùng cá nhân và gia đình	4900772711	24-04-2014
Ban quản lý khu du lịch Mẫu Sơn	Lạng Sơn	KM14+500, Khu du lịch Mẫu Sơn - Huyện Lộc Bình - Lạng Sơn	Hoạt động của các đại lý du lịch, kinh doanh tua du lịch và các dịch vụ hỗ trợ, liên quan đến quảng bá và tổ chức tua du lịch	4900772302	10-04-2014
Trường Mầm Non Xã Vân Mộng	Lạng Sơn	ôn Cựu II - Huyện Lộc Bình - Lạng Sơn	Giáo dục mầm non	4900772172	08-04-2014
Trường Mầm Non Xã Tĩnh Bắc	Lạng Sơn	Thôn Bó Luồng - Huyện Lộc Bình - Lạng Sơn	Giáo dục mầm non	4900771933	01-04-2014
Trường Mầm Non Xã Tam Gia	Lạng Sơn	Thôn Pò Nâm - Huyện Lộc Bình - Lạng Sơn	Giáo dục mầm non	4900771771	27-03-2014
Công Ty Than Na Dương - Vvmi - Chi Nhánh Tổng Công Ty Công Nghiệp Mỏ Việt Bắc Tkv - Ctcp	Lạng Sơn	Khu 4 - Thị trấn Na Dương - Huyện Lộc Bình - Lạng Sơn	Khai thác và thu gom than cứng	0100100015-017	18-03-2014
Trường Mầm Non Xã Xuân Tình	Lạng Sơn	Khòn Nà - Huyện Lộc Bình - Lạng Sơn	Giáo dục mầm non	4900771404	11-03-2014
Công Ty TNHH Long Tân Lạng Sơn	Lạng Sơn	thôn Pò Coóc - Xã Tú Đoạn - Huyện Lộc Bình - Lạng Sơn	Sản xuất plastic và cao su tổng hợp dạng nguyên sinh	4900771348	10-03-2014
Trường Mầm Non Xã Hiệp Hạ	Lạng Sơn	Thôn Tằm Pục - Huyện Lộc Bình - Lạng Sơn	Giáo dục mầm non	4900771316	07-03-2014
Ngân Hàng Nông Nghiệp Và Phát Triển Nông Thôn Việt Nam - Chi Nhánh Huyện Lộc Bình Lạng Sơn	Lạng Sơn	Số 01, phố Bờ Sông - Thị trấn Lộc Bình - Huyện Lộc Bình - Lạng Sơn	Hoạt động trung gian tiền tệ khác	0100686174-808	13-12-2013
Doanh Nghiệp Tư Nhân Phùng Quắn Thế	Lạng Sơn	Số 121, khu Lao Động - Huyện Lộc Bình - Lạng Sơn	Bán lẻ hàng hóa khác mới trong các cửa hàng chuyên doanh	4900764809	17-10-2013
Doanh Nghiệp Tư Nhân Minh Toàn Lộc Bình	Lạng Sơn	Số 11, khu Hòa Bình - Huyện Lộc Bình - Lạng Sơn	Bán lẻ hàng hóa khác mới trong các cửa hàng chuyên doanh	4900764781	17-10-2013
Doanh Nghiệp Tư Nhân Vàng Bạc Chung Thái	Lạng Sơn	Số 35, khu Bờ Sông - Huyện Lộc Bình - Lạng Sơn	Bán lẻ hàng hóa khác mới trong các cửa hàng chuyên doanh	4900764774	17-10-2013
Doanh Nghiệp Tư Nhân Thắng Hằng Lộc Bình	Lạng Sơn	Khu Hòa Bình - Huyện Lộc Bình - Lạng Sơn	Bán lẻ hàng hóa khác mới trong các cửa hàng chuyên doanh	4900764742	17-10-2013
Công Ty TNHH Mtv Minh Hiển Lạng Sơn	Lạng Sơn	Số 162, Khu Lao Động - Huyện Lộc Bình - Lạng Sơn	Bán buôn đồ dùng khác cho gia đình	4900763682	18-09-2013
Công Ty TNHH Mtv Xây Dựng Dương Lộc	Lạng Sơn	Thôn Pò Lọi - Xã Tú Đoạn - Huyện Lộc Bình - Lạng Sơn	Xây dựng công trình đường sắt và đường bộ	4900763403	03-09-2013
Công Ty TNHH Mtv Huy Phong Ls	Lạng Sơn	Số 44, khu Cầu Lấm - Thị trấn Lộc Bình - Huyện Lộc Bình - Lạng Sơn	Xây dựng nhà các loại	4900762946	06-08-2013
Vi Văn Bằng	Lạng Sơn	Khu Lao Động - Huyện Lộc Bình - Lạng Sơn	Hoạt động dịch vụ hỗ trợ cho vận tải	4900762551	16-07-2013
Công Ty TNHH Mtv Thiết Kế Xây Dựng Thành Đạt	Lạng Sơn	Khu Bản Kho - Thị trấn Lộc Bình - Huyện Lộc Bình - Lạng Sơn	Hoạt động kiến trúc và tư vấn kỹ thuật có liên quan	4900761646	11-06-2013
Hợp tác xã Sơn Ngọc Việt	Lạng Sơn	Khu kinh tế cửa khẩu Chi Ma - Xã Yên Khoái - Huyện Lộc Bình - Lạng Sơn	Bốc xếp hàng hóa	4900761653	11-06-2013
Trường THCS Xã Xuân Tình	Lạng Sơn	Xuân Tình - Xã Xuân Tình - Huyện Lộc Bình - Lạng Sơn	Giáo dục trung học cơ sở	4900761068	16-05-2013
Công Ty Cổ Phần Sơn Long Lạng Sơn	Lạng Sơn	Khu Chộc Vằng - Thị trấn Lộc Bình - Huyện Lộc Bình - Lạng Sơn	Nhân và chăm sóc cây giống nông nghiệp	4900761029	15-05-2013
Trường Mầm Non Xã Tam Gia	Lạng Sơn	Thôn Pò Nâm - Xã Tam Gia - Huyện Lộc Bình - Lạng Sơn	Giáo dục mầm non	4900760480	23-04-2013
Trường Mầm Non Xã Lợi Bác	Lạng Sơn	Thôn Nà U - Xã Lợi Bác - Huyện Lộc Bình - Lạng Sơn	Giáo dục mầm non	4900760473	23-04-2013
Trường Mầm Non Xã Xuân Lễ	Lạng Sơn	Bản Lầy - Huyện Lộc Bình - Lạng Sơn	Giáo dục mầm non	4900760297	16-04-2013
Công Ty TNHH Mtv Dịch Vụ & Thương Mại Quang Hưng	Lạng Sơn	Xóm Giao Thông, khu Nhà Thờ - Thị trấn Lộc Bình - Huyện Lộc Bình - Lạng Sơn	Bán buôn thực phẩm	4900760089	05-04-2013
Trường Mầm Non Xã Hữu Lân	Lạng Sơn	Vinh Tiên - Xã Hữu Lân - Huyện Lộc Bình - Lạng Sơn	Giáo dục mầm non	4900760071	05-04-2013
Công Ty TNHH Thương Mại Và Xuất Nhập Khẩu Đại An Lộc Bình	Lạng Sơn	Khu ki ốt Công ty Tuấn Minh, cửa khẩu Chi Ma - Xã Yên Khoái - Huyện Lộc Bình - Lạng Sơn	Bán buôn nông, lâm sản nguyên liệu (trừ gỗ, tre, nứa) và động vật sống	4900757953	22-01-2013
Trung tâm Quản lý Cửa khẩu Chi Ma	Lạng Sơn	Cửa khẩu Chi Ma - Xã Yên Khoái - Huyện Lộc Bình - Lạng Sơn	Hoạt động của Đảng cộng sản, tổ chức chính trị - xã hội, hoạt động quản lý nhà nước nói chung và kinh tế tổng hợp	4900349337-001	28-12-2012
Văn Phòng Đại Diện Công Ty TNHH Xây Dựng Vĩnh Long Tại Chi Ma	Lạng Sơn	Khu kinh tế cửa khẩu Chi Ma - Xã Yên Khoái - Huyện Lộc Bình - Lạng Sơn	Bán buôn vật liệu, thiết bị lắp đặt khác trong xây dựng	4900403721-001	03-10-2012
Công Ty TNHH Mtv Máy Tính Đức Hạnh	Lạng Sơn	Số 30, khu Minh  Khai - Thị trấn Lộc Bình - Huyện Lộc Bình - Lạng Sơn	Bán lẻ máy vi tính, thiết bị ngoại vi, phần mềm và thiết bị viễn thông trong các cửa hàng chuyên doanh	4900751694	21-09-2012
Trường Mần Non Xã Hiệp Hạ	Lạng Sơn	Tằm Pục - Xã Hiệp Hạ - Huyện Lộc Bình - Lạng Sơn	Giáo dục mầm non	4900743742	03-08-2012
Công Ty TNHH Thương Mại Quảng Cáo Bảo ân	Lạng Sơn	Số 133, khu Minh Khai - Thị trấn Lộc Bình - Huyện Lộc Bình - Lạng Sơn	Quảng cáo	4900741985	30-07-2012
Công Ty TNHH Mtv Minh Hoàng Lộc Bình	Lạng Sơn	Số 108, khu Cầu Lấm - Thị trấn Lộc Bình - Huyện Lộc Bình - Lạng Sơn	Xây dựng nhà các loại	4900736826	25-06-2012
Trường MN Xã Xuân Tình	Lạng Sơn	Xuân Tình - Xã Xuân Tình - Huyện Lộc Bình - Lạng Sơn	Giáo dục mầm non	4900736664	21-06-2012
Trường MN xã Như Khuê	Lạng Sơn	Như Khuê - Xã Như Khuê - Huyện Lộc Bình - Lạng Sơn	Giáo dục mầm non	4900732726	31-05-2012
Trường Mần Non Xã Hữu Khánh	Lạng Sơn	Thôn Bản Khiếng - Thị trấn Lộc Bình - Huyện Lộc Bình - Lạng Sơn	Giáo dục mầm non	4900727469	10-05-2012
Trung tâm phát triển quỹ đất	Lạng Sơn	Khu Bản Kho - Thị trấn Lộc Bình - Huyện Lộc Bình - Lạng Sơn	Hoạt động của các tổ chức khác	4900723873	26-04-2012
Công Ty TNHH Mtv ánh Vượng	Lạng Sơn	Bản Rị - Xã Hữu Khánh - Huyện Lộc Bình - Lạng Sơn	Sản xuất đồ uống không cồn, nước khoáng	4900720752	23-04-2012
Trường MN Xã Quan Bản	Lạng Sơn	Nà ái - Xã Quan Bản - Huyện Lộc Bình - Lạng Sơn	Giáo dục mầm non	4900720706	20-04-2012
Công Ty Cổ Phần Xuất Nhập Khẩu Bmv Anh Toàn	Lạng Sơn	Khu tái định cư Chi Ma - Xã Yên Khoái - Huyện Lộc Bình - Lạng Sơn	Hoạt động dịch vụ hỗ trợ kinh doanh khác còn lại chưa được phân vào đâu	4900717799	16-04-2012
Công ty Nhiệt điện Na Dương - Vinacomin (Nộp thuế hộ nhà thầu)	Lạng Sơn	xã Sàn Viên - Xã Sàn Viên - Huyện Lộc Bình - Lạng Sơn	Hoạt động kiến trúc; kiểm tra và phân tích kỹ thuật	4900708970	20-03-2012
Doanh Nghiệp Tư Nhân Nguyễn Phú Lộc	Lạng Sơn	Số nhà 161, phố Lao động (trên đường 4B) - Thị trấn Lộc Bình - Huyện Lộc Bình - Lạng Sơn	Vận tải hàng hóa bằng đường bộ	4900701238	10-02-2012
Công Ty Cổ Phần Đầu Tư Phát Triển Thăng Long Lạng Sơn	Lạng Sơn	Khu liên hợp kinh tế cửa khẩu Chi Ma, Thôn Chi Ma - Xã Yên Khoái - Huyện Lộc Bình - Lạng Sơn	Kinh doanh bất động sản, quyền sử dụng đất thuộc chủ sở hữu, chủ sử dụng hoặc đi thuê	4900699317	12-01-2012
Chi Nhánh Công Ty TNHH Mtv Thương Mại Và Xuất Nhập Khẩu Việt Trung Tại Lạng Sơn	Lạng Sơn	Thôn Nà Miền - Xã Đông Quan - Huyện Lộc Bình - Lạng Sơn	Bán buôn nông, lâm sản nguyên liệu (trừ gỗ, tre, nứa) và động vật sống	0104371707-001	24-10-2011
Công Ty TNHH Mtv Trần Quang Nghĩa	Lạng Sơn	Khu dịch vụ kinh doanh tổng hợp Trần Quang Nghĩa, Cửa khẩu C - Xã Yên Khoái - Huyện Lộc Bình - Lạng Sơn	Bán buôn chuyên doanh khác chưa được phân vào đâu	4900669714	10-08-2011
Chi Nhánh Vật Tư Nông Nghiệp Lộc Bình - Công Ty Cổ Phần Vật Tư Nông Nghiệp Lạng Sơn	Lạng Sơn	Phố Phiêng Quăn - Thị trấn Lộc Bình - Huyện Lộc Bình - Lạng Sơn	Bán lẻ hàng hóa khác mới trong các cửa hàng chuyên doanh	4900225356-007	21-06-2011
Văn Phòng Đại Diện Công Ty Cổ Phần Sản Xuất Và Thương Mại Đài Loan Tại Chi Ma Lạng Sơn	Lạng Sơn	Ki ốt số 6, khu ki ốt Tuấn Minh, Cửa khẩu Chi Ma - Xã Yên Khoái - Huyện Lộc Bình - Lạng Sơn	Bán buôn đồ dùng khác cho gia đình	0200493553-006	02-06-2011
Công Ty TNHH Mtv Bằng Giang Ls	Lạng Sơn	Bản Rỵ - Xã Hữu Khánh - Huyện Lộc Bình - Lạng Sơn	Thu nhặt sản phẩm từ rừng không phải gỗ và lâm sản khác	4900654605	13-05-2011
Trường THPT Tú Đoạn Lộc Bình	Lạng Sơn	Rinh Chùa - Huyện Lộc Bình - Lạng Sơn	Giáo dục trung học cơ sở và trung học phổ thông	4900652968	05-05-2011
Cửa hàng nội thất Đức Hạnh	Lạng Sơn	Số 01 Khu Hòa Bình - Thị trấn Lộc Bình - Huyện Lộc Bình - Lạng Sơn	Bán lẻ thảm, đệm, chăn, màn, rèm, vật liệu phủ tường và sàn trong các cửa hàng chuyên doanh	4900652710	04-05-2011
Đồn Biên Phòng Chi Ma	Lạng Sơn	Gốc Nhãn - Xã Yên Khoái - Huyện Lộc Bình - Lạng Sơn	Hoạt động của Đảng cộng sản, tổ chức chính trị - xã hội, hoạt động quản lý nhà nước nói chung và kinh tế tổng hợp	4900222299-002	26-04-2011
Công Ty TNHH Mtv Nam Vượng	Lạng Sơn	Số 43, khu 5A - Thị trấn Na Dương - Huyện Lộc Bình - Lạng Sơn	Bán buôn nông, lâm sản nguyên liệu (trừ gỗ, tre, nứa) và động vật sống	4900642670	21-03-2011
Công Ty TNHH Mtv Thương Mại Và Xuất Nhập Khẩu Cường Thuận	Lạng Sơn	Số 38, khu 6 - Thị trấn Na Dương - Huyện Lộc Bình - Lạng Sơn	Khai thác lâm sản khác trừ gỗ	4900641010	11-03-2011
Doanh Nghiệp Tư Nhân Thương Mại Nghĩa Lâm	Lạng Sơn	Thôn Phiêng Quăn - Xã Đồng Bục - Huyện Lộc Bình - Lạng Sơn	Thu nhặt sản phẩm từ rừng không phải gỗ và lâm sản khác	4900641003	11-03-2011
Công Ty TNHH Khoáng Sản Vi Gia	Lạng Sơn	Số 12, Na Dương Bản - Thị trấn Na Dương - Huyện Lộc Bình - Lạng Sơn	Sản xuất than cốc	4900640634	09-03-2011
Công Ty TNHH Mtv Sản Xuất Cơ Khí Thu Giang	Lạng Sơn	Phiêng Quăn - Xã Đồng Bục - Huyện Lộc Bình - Lạng Sơn	Đúc sắt thép	4900638667	01-03-2011
Công Ty TNHH Thương Mại Tổng Hợp Việt Anh Lạng Sơn	Lạng Sơn	Cửa khẩu Chi Ma, Thôn Chi Ma - Xã Yên Khoái - Huyện Lộc Bình - Lạng Sơn	Bán lẻ khác trong các cửa hàng kinh doanh tổng hợp	4900632129	18-01-2011
Công Ty TNHH Mtv Hoa Nam	Lạng Sơn	Số 12, Na Dương Bản - Thị trấn Na Dương - Huyện Lộc Bình - Lạng Sơn	Sản xuất sản phẩm chịu lửa	4900630795	08-01-2011
