Công Ty TNHH Mtv Hưng Ngọc Minh	Lạng Sơn	Thôn Nà Noọng - Xã Đề Thám - Huyện Tràng Định - Lạng Sơn	Xây dựng công trình đường sắt và đường bộ	4900646442	01-04-2011
Chi nhánh Công ty Cổ phần Thương mại Xuất nhập khẩu Hải Yến	Lạng Sơn	Số 66A, khu 3 - Thị trấn Thất Khê - Huyện Tràng Định - Lạng Sơn	Xây dựng công trình kỹ thuật dân dụng	4900596618-001	01-04-2011
Công Ty CP Xây Dựng Việt Ngân	Lạng Sơn	Khu 2 - Thị trấn Thất Khê - Huyện Tràng Định - Lạng Sơn	Xây dựng nhà các loại	4900632055	18-01-2011
Doanh Nghiệp Tư Nhân Hoàng Hải Đăng	Lạng Sơn	Thôn Bản Chang - Xã Chi Lăng - Huyện Tràng Định - Lạng Sơn	Khai thác đá, cát, sỏi, đất sét	4900620701	30-11-2010
Công Ty CP Thu Hương	Lạng Sơn	Thôn Pác Luồng - Xã Đề Thám - Huyện Tràng Định - Lạng Sơn	Hoạt động kiến trúc và tư vấn kỹ thuật có liên quan	4900619664	26-11-2010
Công Ty TNHH Hoàng Huy	Lạng Sơn	Thôn Bản Mạ - Xã Đại Đồng - Huyện Tràng Định - Lạng Sơn	Khai thác đá, cát, sỏi, đất sét	4900612683	08-10-2010
Công Ty CP Sản Xuất Và Đầu Tư Quyết Thắng	Lạng Sơn	Thôn Kéo Quang - Xã Chi Lăng - Huyện Tràng Định - Lạng Sơn	Sản xuất vật liệu xây dựng từ đất sét	4900612468	05-10-2010
Công Ty TNHH Cầu Thịnh	Lạng Sơn	Thôn Cốc Cưởm - Xã Chi Lăng - Huyện Tràng Định - Lạng Sơn	Sản xuất đồ uống không cồn, nước khoáng	4900601628	26-07-2010
Công Ty Cổ Phần Thương Mại Xuất Nhập Khẩu Hải Yến	Lạng Sơn	Số 66A, khu III - Thị trấn Thất Khê - Huyện Tràng Định - Lạng Sơn	Sản xuất đồ uống không cồn, nước khoáng	4900596618	28-06-2010
Công ty Cổ phần Xây dựng Rạng Đông	Lạng Sơn	Số 32 Cẩu Pung, khu III - Thị trấn Thất Khê - Huyện Tràng Định - Lạng Sơn	Xây dựng nhà các loại	4900538278	29-04-2010
Doanh Nghiệp Tư Nhân Lan Hương	Lạng Sơn	Thôn Nà Pò - Xã Quốc Việt - Huyện Tràng Định - Lạng Sơn	Bán lẻ nhiên liệu động cơ trong các cửa hàng chuyên doanh	4900511621	17-03-2010
Công Ty TNHH MTV Nhung Hưởng	Lạng Sơn	Thôn Cốc Phát - Xã Đại Đồng - Huyện Tràng Định - Lạng Sơn	Bán mô tô, xe máy	4900492390	22-01-2010
Liên đoàn lao động huyện Tràng Định	Lạng Sơn	Khu I - Huyện Tràng Định - Lạng Sơn	Hoạt động của Đảng cộng sản, tổ chức chính trị - xã hội, quản lý nhà nước, an ninh quốc phòng và bảo đảm xã hội bắt buộc	4900417315	30-10-2009
Trường tiểu học Bắc ái II (Mầm non)	Lạng Sơn	Pò Đoóng - Huyện Tràng Định - Lạng Sơn	Giáo dục mầm non	4900417322	30-10-2009
UBND xã Bắc ái	Lạng Sơn	Khuổi Vai - Huyện Tràng Định - Lạng Sơn	Hoạt động của Đảng cộng sản, tổ chức chính trị - xã hội, hoạt động quản lý nhà nước nói chung và kinh tế tổng hợp	4900417354	30-10-2009
Trường mầm non Tân Tiến	Lạng Sơn	áng Mò - Huyện Tràng Định - Lạng Sơn	Giáo dục mầm non	4900417361	30-10-2009
Trường THPT  Tràng Định	Lạng Sơn	Khu I - Huyện Tràng Định - Lạng Sơn	Giáo dục trung học cơ sở và trung học phổ thông	4900417379	30-10-2009
UBND xã Tân Yên	Lạng Sơn	Xã Tân Yên - Huyện Tràng Định - Lạng Sơn	Hoạt động của Đảng cộng sản, tổ chức chính trị - xã hội, hoạt động quản lý nhà nước nói chung và kinh tế tổng hợp	4900417386	30-10-2009
Trường mầm non Kim Đồng	Lạng Sơn	Pàn Dào - Huyện Tràng Định - Lạng Sơn	Giáo dục mầm non	4900417033	30-10-2009
Trường tiểu học Bắc ái II	Lạng Sơn	Pò Đoong - Huyện Tràng Định - Lạng Sơn	Giáo dục tiểu học	4900417347	30-10-2009
Trường PTCS Khánh Long (Tiểu học)	Lạng Sơn	Khuổi Bây - Huyện Tràng Định - Lạng Sơn	Giáo dục tiểu học	4900416777	29-10-2009
Trường PTCS Khánh Long (Mầm non)	Lạng Sơn	Khuổi Bây - Huyện Tràng Định - Lạng Sơn	Giáo dục mầm non	4900416784	29-10-2009
Trường tiểu học Tân Tiến	Lạng Sơn	áng Mò - Huyện Tràng Định - Lạng Sơn	Giáo dục tiểu học	4900416752	29-10-2009
Trường PTCS Khánh Long (THCS)	Lạng Sơn	Khuổi Bây - Huyện Tràng Định - Lạng Sơn	Giáo dục trung học cơ sở và trung học phổ thông	4900414138	27-10-2009
Trường tiểu học Kim Đồng	Lạng Sơn	Pàn Dào - Huyện Tràng Định - Lạng Sơn	Giáo dục tiểu học	4900414152	27-10-2009
UBND xã Vĩnh Tiến	Lạng Sơn	Phiêng Sâu - Huyện Tràng Định - Lạng Sơn	Hoạt động của Đảng cộng sản, tổ chức chính trị - xã hội, hoạt động quản lý nhà nước nói chung và kinh tế tổng hợp	4900411835	23-10-2009
Trường THCS Tri Phương	Lạng Sơn	Kéo Quân - Huyện Tràng Định - Lạng Sơn	Giáo dục trung học cơ sở và trung học phổ thông	4900411810	23-10-2009
Trường tiểu học Đề Thám	Lạng Sơn	Pò Mần - Huyện Tràng Định - Lạng Sơn	Giáo dục tiểu học	4900411264	22-10-2009
UBND xã Cao Minh	Lạng Sơn	Vàng Can - Huyện Tràng Định - Lạng Sơn	Hoạt động của Đảng cộng sản, tổ chức chính trị - xã hội, hoạt động quản lý nhà nước nói chung và kinh tế tổng hợp	4900411070	22-10-2009
UBND xã Khánh Long	Lạng Sơn	Khuổi Bây - Huyện Tràng Định - Lạng Sơn	Hoạt động của Đảng cộng sản, tổ chức chính trị - xã hội, hoạt động quản lý nhà nước nói chung và kinh tế tổng hợp	4900407613	19-10-2009
Bảo hiểm xã hội	Lạng Sơn	Số 05 - đường 10/10 - Huyện Tràng Định - Lạng Sơn	Bảo hiểm phi nhân thọ khác	4900407638	19-10-2009
Kho bạc huyện Tràng Định	Lạng Sơn	Khu I - Thị trấn Thất Khê - Thị trấn Thất Khê - Huyện Tràng Định - Lạng Sơn	Hoạt động quản lý nhà nước nói chung và kinh tế tổng hợp	4900265599-004	14-10-2009
Văn phòng HĐND - UBND huyện Tràng Định	Lạng Sơn	Khu I - Thị trấn Thất Khê - Huyện Tràng Định - Lạng Sơn	Hoạt động của Đảng cộng sản, tổ chức chính trị - xã hội, hoạt động quản lý nhà nước nói chung và kinh tế tổng hợp	4900403658	07-10-2009
Thanh tra huyện Tràng Định	Lạng Sơn	Khu I - Thị trấn Thất Khê - Huyện Tràng Định - Lạng Sơn	Hoạt động của Đảng cộng sản, tổ chức chính trị - xã hội, quản lý nhà nước, an ninh quốc phòng và bảo đảm xã hội bắt buộc	4900403640	07-10-2009
Trường tiểu học Tân Minh	Lạng Sơn	Bản Chang - Thị trấn Thất Khê - Huyện Tràng Định - Lạng Sơn	Giáo dục tiểu học	4900403760	07-10-2009
Trường mầm non Tân Minh	Lạng Sơn	Bản Chang - Tân Minh - Huyện Tràng Định - Lạng Sơn	Giáo dục mầm non	4900403753	07-10-2009
Trường PTCS Cao Minh	Lạng Sơn	Cao Minh - Huyện Tràng Định - Lạng Sơn	Giáo dục và đào tạo	4900403665	07-10-2009
Trường tiểu học xã Hùng Sơn	Lạng Sơn	Bản Chu - Hùng Sơn - Huyện Tràng Định - Lạng Sơn	Giáo dục tiểu học	4900403672	07-10-2009
Trường THCS Tân Minh	Lạng Sơn	Bản Chang - Tân Minh - Huyện Tràng Định - Lạng Sơn	Giáo dục trung học cơ sở và trung học phổ thông	4900403778	07-10-2009
Trạm cấp nước sinh hoạt huyện Tràng Định	Lạng Sơn	Khu III - Thị trấn Thất Khê - Huyện Tràng Định - Lạng Sơn	Khai thác, xử lý và cung cấp nước	4900403390	06-10-2009
Trường mầm non Trung Thành	Lạng Sơn	Nà Màn - Trung Thành - Huyện Tràng Định - Lạng Sơn	Giáo dục mầm non	4900403418	06-10-2009
Trường tiểu học xã Trung Thành	Lạng Sơn	Nà Màn - Trung Thành - Huyện Tràng Định - Lạng Sơn	Giáo dục tiểu học	4900403400	06-10-2009
Trường THCS Vĩnh Tiến	Lạng Sơn	Phiêng Sâu - Vĩnh Tiến - Huyện Tràng Định - Lạng Sơn	Giáo dục trung học cơ sở và trung học phổ thông	4900400720	30-09-2009
Trường THCS Tân Yên	Lạng Sơn	Pác Mười - Tân Yên - Huyện Tràng Định - Lạng Sơn	Giáo dục trung học cơ sở và trung học phổ thông	4900400914	30-09-2009
Trường tiểu học Vĩnh Tiến	Lạng Sơn	Phiêng Sâu - Vĩnh Tiến - Huyện Tràng Định - Lạng Sơn	Giáo dục tiểu học	4900400752	30-09-2009
Trường mầm non Vĩnh Tiến	Lạng Sơn	Phiêng Sâu - Vĩnh Tiến - Huyện Tràng Định - Lạng Sơn	Giáo dục mầm non	4900400784	30-09-2009
Trường mầm non Tân Yên	Lạng Sơn	Pác Mười - Tân Yên - Huyện Tràng Định - Lạng Sơn	Giáo dục mầm non	4900400819	30-09-2009
Trường tiều học Tân Yên	Lạng Sơn	Pác Mười - Tân Yên - Huyện Tràng Định - Lạng Sơn	Giáo dục tiểu học	4900400865	30-09-2009
Trường mầm non Chí Minh	Lạng Sơn	Côc Toòng - Chí Minh - Huyện Tràng Định - Lạng Sơn	Giáo dục mầm non	4900397274	25-09-2009
Trường tiểu học Đại Đồng I	Lạng Sơn	Pò Bó - Đại Đồng - Huyện Tràng Định - Lạng Sơn	Giáo dục tiểu học	4900395446	25-09-2009
Trường mầm non Bắc ái I	Lạng Sơn	Khuổi Vai - Bắc ái - Huyện Tràng Định - Lạng Sơn	Giáo dục mầm non	4900395492	25-09-2009
Phòng Giáo dục và Đào tạo	Lạng Sơn	Khu I - Thị trấn Thất Khê - Huyện Tràng Định - Lạng Sơn	Giáo dục và đào tạo	4900397348	25-09-2009
Trường THCS Tân Tiến	Lạng Sơn	áng Mò - Tân Tiến - Huyện Tràng Định - Lạng Sơn	Giáo dục trung học cơ sở và trung học phổ thông	4900395460	25-09-2009
Trường tiểu học Bắc ái I	Lạng Sơn	Khuổi Vai - Bắc ái - Huyện Tràng Định - Lạng Sơn	Giáo dục tiểu học	4900395527	25-09-2009
Trường THCS Bắc ái I	Lạng Sơn	Khuổi Vai - Bắc ái - Huyện Tràng Định - Lạng Sơn	Giáo dục trung học cơ sở và trung học phổ thông	4900395534	25-09-2009
Trường tiểu học Chí Minh	Lạng Sơn	Cốc Toòng - Chí Minh - Huyện Tràng Định - Lạng Sơn	Giáo dục tiểu học	4900394410	24-09-2009
Trường THCS Chí Minh	Lạng Sơn	Nà Cạo - Chí Minh - Huyện Tràng Định - Lạng Sơn	Giáo dục trung học cơ sở và trung học phổ thông	4900394428	24-09-2009
Phòng Lao động - Thương binh và Xã hội	Lạng Sơn	Khu III - Thị trấn Thất Khê - Huyện Tràng Định - Lạng Sơn	Hoạt động bảo đảm xã hội bắt buộc	4900394442	24-09-2009
Phòng nội vụ	Lạng Sơn	Khu I - Thị trấn Thất Khê - Huyện Tràng Định - Lạng Sơn	Hoạt động của Đảng cộng sản, tổ chức chính trị - xã hội, hoạt động quản lý nhà nước nói chung và kinh tế tổng hợp	4900391723	23-09-2009
Đội duy tu cầu đường	Lạng Sơn	Nà Nghiều - Đại Đồng - Huyện Tràng Định - Lạng Sơn	Lắp đặt hệ thống điện, hệ thống cấp thoát nước và lắp đặt xây dựng khác	4900389749	21-09-2009
Huyện Uỷ	Lạng Sơn	Khu I - Thị trấn Thất Khê - Huyện Tràng Định - Lạng Sơn	Hoạt động của Đảng cộng sản, tổ chức chính trị - xã hội, hoạt động quản lý nhà nước nói chung và kinh tế tổng hợp	4900387910	18-09-2009
Trường mầm non Đội Cấn	Lạng Sơn	Nà Phai - Đội Cấn - Huyện Tràng Định - Lạng Sơn	Giáo dục mầm non	4900383641	17-09-2009
Trường tiểu học Đội Cấn	Lạng Sơn	Nà Phai - Đội Cấn - Huyện Tràng Định - Lạng Sơn	Giáo dục tiểu học	4900383680	17-09-2009
Trường THCS Đội Cấn	Lạng Sơn	Nà Phai - Đội Cấn - Huyện Tràng Định - Lạng Sơn	Giáo dục trung học cơ sở và trung học phổ thông	4900383747	17-09-2009
Trường tiểu học xã Tri Phương	Lạng Sơn	Bản Ne - xã Tri Phương - Huyện Tràng Định - Lạng Sơn	Giáo dục tiểu học	4900380714	14-09-2009
Trường THCS xã Đề Thám	Lạng Sơn	Pò Mần - xã Đề Thám - Huyện Tràng Định - Lạng Sơn	Giáo dục trung học cơ sở và trung học phổ thông	4900380640	14-09-2009
Trung tâm bồi dưỡng chính trị	Lạng Sơn	Kéo Quang - Chi Lăng - Huyện Tràng Định - Lạng Sơn	Giáo dục và đào tạo	4900380390	10-09-2009
Hội nông dân	Lạng Sơn	Khu II - Thị trấn Thất Khê - Huyện Tràng Định - Lạng Sơn	Nông nghiệp và hoạt động dịch vụ có liên quan	4900380400	10-09-2009
Trạm Khí tượng	Lạng Sơn	Khu V - Thị trấn Thất Khê - Huyện Tràng Định - Lạng Sơn	NÔNG NGHIỆP, LÂM NGHIỆP VÀ THUỶ SẢN	4900379500	09-09-2009
Uỷ ban Mặt trận tổ quốc huyện Tràng Định	Lạng Sơn	Khu I - Thị trấn Thất Khê - Huyện Tràng Định - Lạng Sơn	Hoạt động của công đoàn	4900379557	09-09-2009
Trường trung học cơ sở Đoàn kết	Lạng Sơn	Nà Slèo - Đoàn Kết - Huyện Tràng Định - Lạng Sơn	Giáo dục trung học cơ sở và trung học phổ thông	4900376997	07-09-2009
Trường Tiểu học Kháng Chiến	Lạng Sơn	Phai Phầy- Kháng Chiến - Huyện Tràng Định - Lạng Sơn	Giáo dục tiểu học	4900376940	05-09-2009
Trường Phổ  thông Dân tộc nội trú- Trung học cơ sở	Lạng Sơn	Khòn Cà- Đại Đồng - Huyện Tràng Định - Lạng Sơn	Giáo dục trung học cơ sở và trung học phổ thông	4900376958	05-09-2009
Trường trung học cơ sở Đại Đồng 2	Lạng Sơn	Đại Đồng - Huyện Tràng Định - Lạng Sơn	Giáo dục trung học cơ sở và trung học phổ thông	4900374220	01-09-2009
Trường tiểu học Chi Lăng	Lạng Sơn	Bản Chang Chi Lăng - Huyện Tràng Định - Lạng Sơn	Giáo dục tiểu học	4900374164	01-09-2009
Trường THCS Kháng Chiến	Lạng Sơn	Thôn Phai Phầy - Huyện Tràng Định - Lạng Sơn	Giáo dục trung học cơ sở và trung học phổ thông	4900374213	01-09-2009
Trường Tiểu Học Đại Đồng 2	Lạng Sơn	Đại Đồng - Huyện Tràng Định - Lạng Sơn	Giáo dục tiểu học	4900374245	01-09-2009
Trường THCS xã Đào Viên	Lạng Sơn	Đào viên - Huyện Tràng Định - Lạng Sơn	Giáo dục trung học cơ sở và trung học phổ thông	4900373925	01-09-2009
Hội chữ Thập đỏ huyện Tràng Định	Lạng Sơn	Khu 1 - Thị Trấn Thất khê - Huyện Tràng Định - Lạng Sơn	Hoạt động chăm sóc, điều dưỡng tập trung	4900372840	31-08-2009
Hội Đông Y	Lạng Sơn	khu 1 Thị Trấn Thất khê - Huyện Tràng Định - Lạng Sơn	Hoạt động của các hội nghề nghiệp	4900372985	31-08-2009
PHòNG GIAO DịCH NGÂN HàNG CHíNH SáCH XH- H. TRàNG ĐịNH	Lạng Sơn	Số 290 đường hoàng Văn Thụ- TT Thất Khê - Huyện Tràng Định - Lạng Sơn	NÔNG NGHIỆP, LÂM NGHIỆP VÀ THUỶ SẢN	4900372576	31-08-2009
Phòng Dân Tộc và Tôn Giáo	Lạng Sơn	Tầng 2 Phòng Tài Chính khu 1 Thất khê - Huyện Tràng Định - Lạng Sơn	Hoạt động dịch vụ tài chính khác (trừ bảo hiểm và bảo hiểm xã hội)	4900368731	23-08-2009
Trường Tiểu học xã Quốc Việt	Lạng Sơn	Bình Độ - Quốc việt - Huyện Tràng Định - Lạng Sơn	Giáo dục tiểu học	4900367978	20-08-2009
Trường Tiểu học Khánh Hoà	Lạng Sơn	Xã Quốc Khánh - Huyện Tràng Định - Lạng Sơn	Giáo dục tiểu học	4900366815	18-08-2009
Trường Mầm non Quốc Khánh	Lạng Sơn	xã Quốc Khánh - Huyện Tràng Định - Lạng Sơn	Giáo dục mầm non	4900365226	13-08-2009
Trường Tiểu học Quốc Khánh	Lạng Sơn	xã Quốc Khánh - Huyện Tràng Định - Lạng Sơn	Giáo dục tiểu học	4900365233	13-08-2009
Toà án Nhân Dân Huyện Tràng Định	Lạng Sơn	khu 5 thị trấn Thất Khê - Huyện Tràng Định - Lạng Sơn	Hoạt động của Đảng cộng sản, tổ chức chính trị - xã hội, hoạt động quản lý nhà nước nói chung và kinh tế tổng hợp	4900364695	10-08-2009
Trường Tiểu học xã Đào Viên	Lạng Sơn	Thôn Pò Mòn xã Đào Viên - Huyện Tràng Định - Lạng Sơn	Giáo dục tiểu học	4900364737	10-08-2009
Trường Tiểu Học Thị Trấn Thất Khê	Lạng Sơn	Thôn Nà Nghiều, xã Đai Đồng - Huyện Tràng Định - Lạng Sơn	Giáo dục tiểu học	4900364705	10-08-2009
Trường Tiểu Học Đoàn Kết	Lạng Sơn	Xã Đoàn Kết - Huyện Tràng Định - Lạng Sơn	Giáo dục tiểu học	4900364712	10-08-2009
Phòng Thống kê huyện Tràng Định	Lạng Sơn	Khu I - thị trấn Thất Khê - Huyện Tràng Định - Lạng Sơn	Hoạt động quản lý nhà nước nói chung và kinh tế tổng hợp	4900356380	29-07-2009
Viện Kiểm sát nhân dân huyện Tràng Định	Lạng Sơn	Khu 4 - Thị trấn Thất Khê - Huyện Tràng Định - Lạng Sơn	Hoạt động của Đảng cộng sản, tổ chức chính trị - xã hội, hoạt động quản lý nhà nước nói chung và kinh tế tổng hợp	4900349545	17-07-2009
Trường Mầm non Hùng Sơn	Lạng Sơn	Bản Chu - Huyện Tràng Định - Lạng Sơn	Giáo dục mầm non	4900343374	07-07-2009
Phòng Văn hoá và Thông tin	Lạng Sơn	Huyện Tràng Định - Huyện Tràng Định - Lạng Sơn	Hoạt động sáng tác, nghệ thuật và giải trí	4900327559	04-06-2009
Đài truyền thanh truyền hình Tràng Định	Lạng Sơn	Khu I- TT Thất Khê - Huyện Tràng Định - Lạng Sơn	Hoạt động sản xuất phim điện ảnh, phim video và chương trình truyền hình	4900316074	24-04-2009
Trường THCS xã Tân Tiến	Lạng Sơn	Ang mò, xã Tân Tiến - Huyện Tràng Định - Lạng Sơn	Giáo dục trung học cơ sở và trung học phổ thông	4900309006	10-04-2009
Trường THCS Trung Thành	Lạng Sơn	Nà Màn, xã Trung Thành - Huyện Tràng Định - Lạng Sơn	Giáo dục trung học cơ sở và trung học phổ thông	4900309013	10-04-2009
Nguyễn Trọng Huyến	Lạng Sơn	Khun 1 Thị trấn Thất khê - Huyện Tràng Định - Lạng Sơn	Hoạt động dịch vụ phục vụ cá nhân khác còn lại chưa được phân vào đâu	4900293980	09-02-2009
Cty TNHH 1 TV  KDC	Lạng Sơn	Khu I Thị trấn Thất Khê - Huyện Tràng Định - Lạng Sơn	Khai thác quặng kim loại	4900289663	18-12-2008
Công ty cổ phần tư vấn xây dựng và thương mại Hanh Thảo	Lạng Sơn	Khu I - thị trấn Thất khê - Huyện Tràng Định - Lạng Sơn	Chuẩn bị mặt bằng	4900287095	17-10-2008
Công Ty Cổ Phần Gia Lộc	Lạng Sơn	Mỏ cát sỏi Hùng Sơn, Thôn Bản Chu - Xã Hùng Sơn - Huyện Tràng Định - Lạng Sơn	Khai thác quặng sắt	4900284351	24-09-2008
DNTN Châu Hậu	Lạng Sơn	Khu 3 Thị trấn Thất Khê - Thị trấn Thất Khê - Huyện Tràng Định - Lạng Sơn	Khai thác đá	4900282636	12-09-2008
Công ty TNHH Đạt Mai	Lạng Sơn	Số 72 Khu 3, Thị trấn Thất Khê - Huyện Tràng Định - Lạng Sơn	Chuẩn bị mặt bằng	4900280318	11-08-2008
Doanh nghiệp tư nhân Thái Bình	Lạng Sơn	Thôn Cốc Phia, xã Quốc Khánh - Huyện Tràng Định - Lạng Sơn	Bán buôn nông, lâm sản nguyên liệu (trừ gỗ, tre, nứa) và động vật sống	4900276375	03-07-2008
Công Ty Cổ Phần Lâm Sản Hồng Giang	Lạng Sơn	Thôn Nà Pò - Xã Quốc Việt - Huyện Tràng Định - Lạng Sơn	Khai thác gỗ	4900273078	29-04-2008
Trường mần non nông thôn xã Đại Đồng	Lạng Sơn	Xã Đại Đồng - Huyện Tràng Định - Lạng Sơn	Giáo dục mầm non	4900272500	23-04-2008
Trường THCS Đại Đồng I	Lạng Sơn	xã Đại Đồng - Huyện Tràng Định - Lạng Sơn	Giáo dục trung học cơ sở và trung học phổ thông	4900272490	23-04-2008
Cty TNHH 1 TV Việt Hưng	Lạng Sơn	Thôn Nà Mè, xã Tri Phương - Huyện Tràng Định - Lạng Sơn	Khai thác đá, cát, sỏi, đất sét	4900271546	28-03-2008
Bưu điện  huyện Tràng định	Lạng Sơn	khu2 thị trấn Thất khê - Huyện Tràng Định - Lạng Sơn	Bưu chính	4900102900-003	19-03-2008
Phòng Y Tế	Lạng Sơn	Khu I - Thị trấn Thất Khê - Huyện Tràng Định - Lạng Sơn	Hoạt động y tế	4900269628	25-01-2008
Trường THCS Hùng Sơn	Lạng Sơn	Hùng Sơn - Huyện Tràng Định - Lạng Sơn	Giáo dục trung học cơ sở và trung học phổ thông	4900269603	25-01-2008
Công ty cổ phần Thuý Nga	Lạng Sơn	Khu II - Thị trấn Thất Khê - Huyện Tràng Định - Lạng Sơn	Bán buôn gạo, thực phẩm, đồ uống và sản phẩm thuốc lá, thuốc lào	4900268737	21-01-2008
Trung tâm Y tế Huyện Tràng Định	Lạng Sơn	Khu II - thị trấn Thất Khê - Huyện Tràng Định - Lạng Sơn	Hoạt động của các phòng khám đa khoa, chuyên khoa và nha khoa	4900265479	29-12-2007
Phòng Công Thương	Lạng Sơn	Khu I TT Thất Khê - Huyện Tràng Định - Lạng Sơn	Hoạt động dịch vụ tài chính khác (trừ bảo hiểm và bảo hiểm xã hội)	4900265528	29-12-2007
Thi hành án Huyện Tràng Định	Lạng Sơn	Khu 5 - thị trấn Thất Khê - Huyện Tràng Định - Lạng Sơn	Hoạt động của Đảng cộng sản, tổ chức chính trị - xã hội, hoạt động quản lý nhà nước nói chung và kinh tế tổng hợp	4900265461	29-12-2007
Phòng tư pháp Huyện Tràng Định	Lạng Sơn	Khu I - thị trấn Thất Khê - Huyện Tràng Định - Lạng Sơn	Hoạt động của Đảng cộng sản, tổ chức chính trị - xã hội, hoạt động quản lý nhà nước nói chung và kinh tế tổng hợp	4900265454	29-12-2007
Hạt kiểm lâm Huyện Tràng Định	Lạng Sơn	Khu 5 - thị trấn Thất Khê - Huyện Tràng Định - Lạng Sơn	Hoạt động của Đảng cộng sản, tổ chức chính trị - xã hội, hoạt động quản lý nhà nước nói chung và kinh tế tổng hợp	4900265447	29-12-2007
Phòng nông nghiệp	Lạng Sơn	Khu 5 TT Thất khê - Huyện Tràng Định - Lạng Sơn	Hoạt động của Đảng cộng sản, tổ chức chính trị - xã hội, hoạt động quản lý nhà nước nói chung và kinh tế tổng hợp	4900265567	29-12-2007
Trung tâm giáo dục thường xuyên huyện Tràng Định	Lạng Sơn	Bò Pó - Xã Đại Đồng - Huyện Tràng Định - Lạng Sơn	Giáo dục khác	4900265172	28-12-2007
Trường THCS Kim Đồng	Lạng Sơn	Thôn Nà Thà - xã Kim Đồng - Huyện Tràng Định - Lạng Sơn	Giáo dục trung học cơ sở và trung học phổ thông	4900265341	28-12-2007
Trường THCS Thất Khê	Lạng Sơn	Nà Đin - Đại Đồng - Huyện Tràng Định - Lạng Sơn	Giáo dục trung học cơ sở và trung học phổ thông	4900265380	28-12-2007
Trường trung học phổ thông Bình Độ	Lạng Sơn	- Huyện Tràng Định - Lạng Sơn	Giáo dục trung học cơ sở và trung học phổ thông	4900265422	28-12-2007
Phòng Tài nguyên - Môi trường Huyện Tràng Định	Lạng Sơn	Khu I - thị trấn Thất Khê - Huyện Tràng Định - Lạng Sơn	Hoạt động của Đảng cộng sản, tổ chức chính trị - xã hội, hoạt động quản lý nhà nước nói chung và kinh tế tổng hợp	4900265207	28-12-2007
Phòng Tài chính - Kế hoạch Huyện Tràng Định	Lạng Sơn	Khu 5 - thị trấn Thất Khê - Huyện Tràng Định - Lạng Sơn	Hoạt động dịch vụ tài chính khác (trừ bảo hiểm và bảo hiểm xã hội)	4900265197	28-12-2007
Trường mầm non 10 - 10	Lạng Sơn	Khu I - Thị trấn Thất Khê - Huyện Tràng Định - Lạng Sơn	Giáo dục mầm non	4900265165	28-12-2007
Trường mầm non Chi Lăng	Lạng Sơn	Thôn Đâu Linh - Xã Chi Lăng - Huyện Tràng Định - Lạng Sơn	Giáo dục mầm non	4900265158	28-12-2007
Công an Huyện Tràng Định	Lạng Sơn	Khu I - thị trấn Thất Khê - Huyện Tràng Định - Lạng Sơn	Hoạt động an ninh, trật tự an toàn xã hội	4900265133	28-12-2007
Trường THCS Đề Thám	Lạng Sơn	Pò mần - Đề Thám883 948 - Huyện Tràng Định - Lạng Sơn	Giáo dục trung học cơ sở và trung học phổ thông	4900265408	28-12-2007
Trường THCS Chi Lăng	Lạng Sơn	Đâu Linh - Chi Lăng - Huyện Tràng Định - Lạng Sơn	Giáo dục trung học cơ sở và trung học phổ thông	4900265366	28-12-2007
Trường trung học cơ sở Quốc Khánh	Lạng Sơn	Xã Quốc Khánh - Huyện Tràng Định - Lạng Sơn	Giáo dục trung học cơ sở và trung học phổ thông	4900265334	28-12-2007
Trường trung học cơ sở xã Quốc Việt	Lạng Sơn	Xã Quốc Việt - Huyện Tràng Định - Lạng Sơn	Giáo dục trung học cơ sở và trung học phổ thông	4900265327	28-12-2007
Trường phổ thông cơ sở Hùng Việt	Lạng Sơn	Xã Hùng Việt - Huyện Tràng Định - Lạng Sơn	Giáo dục trung học cơ sở và trung học phổ thông	4900265292	28-12-2007
Trường mầm non Tri phương	Lạng Sơn	Tri phương - Huyện Tràng Định - Lạng Sơn	Giáo dục mầm non	4900264644	26-12-2007
Trường mầm non Quốc Khánh	Lạng Sơn	Xã Quốc Khánh - Huyện Tràng Định - Lạng Sơn	Giáo dục mầm non	4900264725	26-12-2007
